level_0	index	wordform1	wordform2	wordform1_orth	wordform2_orth	stem	output
53736	73253	r eː b ɛ l iː r ə n	r eː b ɛ l iː r t	rebellieren	rebelliert	⋊ r eː b ɛ l iː r ə n ⋉	⋊ r eː b ɛ l iː r t ⋉
53744	73262	b l ai̯ x ə n	g ə b l ai̯ x t	bleichen	gebleicht	⋊ b l a i x ə n ⋉	⋊ b l a i x t ⋉
53776	73306	ʃ ɪ m ə l n	g ə ʃ ɪ m ə l t	schimmeln	geschimmelt	⋊ ʃ ɪ m ə l n ⋉	⋊ ʃ ɪ m ə l t ⋉
53786	73319	g a k s ə n	g ə g a k s t	gacksen	gegackst	⋊ g a k s ə n ⋉	⋊ g a k s t ⋉
53796	73332	a p b iː g ə n	a p g ə b oː g ə n	abbiegen	abgebogen	⋊ a p b iː g ə n ⋉	⋊ a p g ə b oː g ə n ⋉
53802	73339	au̯ s ʃ ɛ ŋ k ə n	au̯ s g ə ʃ ɛ ŋ k t	ausschenken	ausgeschenkt	⋊ a u s ʃ ɛ ŋ k ə n ⋉	⋊ a u s g ə ʃ ɛ ŋ k t ⋉
53853	73404	ts ɛ r ʃ t r ai̯ t ə n	ts ɛ r ʃ t r ɪ t ə n	zerstreiten	zerstritten	⋊ ts ɛ r ʃ t r a i t ə n ⋉	⋊ ts ɛ r ʃ t r ɪ t ə n ⋉
53860	73413	b l ʊ f ə n	g ə b l ʊ f t	bluffen	geblufft	⋊ b l ʊ f ə n ⋉	⋊ b l ʊ f t ⋉
53862	73416	ʃ r a m ə n	g ə ʃ r a m t	schrammen	geschrammt	⋊ ʃ r a m ə n ⋉	⋊ ʃ r a m t ⋉
53863	73418	r œ n t g ə n	g ə r œ n t k t	röntgen	geröntgt	⋊ r œ n t g ə n ⋉	⋊ r œ n t k t ⋉
53875	73434	b ə v a x ə n	b ə v a x t	bewachen	bewacht	⋊ b ə v a x ə n ⋉	⋊ b ə v a x t ⋉
53922	73499	d ɔ p ə l n	g ə d ɔ p ə l t	doppeln	gedoppelt	⋊ d ɔ p ə l n ⋉	⋊ d ɔ p ə l t ⋉
53930	73510	yː b ə r d eː n ə n	yː b ə r d eː n t	überdehnen	überdehnt	⋊ yː b ə r d eː n ə n ⋉	⋊ yː b ə r d eː n t ⋉
53936	73518	f ɛ r r a m ə l n	f ɛ r r a m ə l t	verrammeln	verrammelt	⋊ f ɛ r r a m ə l n ⋉	⋊ f ɛ r r a m ə l t ⋉
53948	73538	m oː f ə l n	g ə m oː f ə l t	mofeln	gemofelt	⋊ m oː f ə l n ⋉	⋊ m oː f ə l t ⋉
53958	73553	k ɔ m p iː l iː r ə n	k ɔ m p iː l iː r t	kompilieren	kompiliert	⋊ k ɔ m p iː l iː r ə n ⋉	⋊ k ɔ m p iː l iː r t ⋉
53974	73574	f ɛ r h a s p ə l n	f ɛ r h a s p ə l t	verhaspeln	verhaspelt	⋊ f ɛ r h a s p ə l n ⋉	⋊ f ɛ r h a s p ə l t ⋉
53986	73593	n aː x d a t iː r ə n	n aː x d a t iː r t	nachdatieren	nachdatiert	⋊ n aː x d a t iː r ə n ⋉	⋊ n aː x d a t iː r t ⋉
54007	73627	a p ʃ t r ɛ ŋ ə n	a p g ə ʃ t r ɛ ŋ t	absträngen	abgesträngt	⋊ a p ʃ t r ɛ ŋ ə n ⋉	⋊ a p g ə ʃ t r ɛ ŋ t ⋉
54027	73656	b l ɪ ŋ k ə r n	g ə b l ɪ ŋ k ə r t	blinkern	geblinkert	⋊ b l ɪ ŋ k ə r n ⋉	⋊ b l ɪ ŋ k ə r t ⋉
54030	73660	f ʊ ŋ k ə l n	g ə f ʊ ŋ k ə l t	funkeln	gefunkelt	⋊ f ʊ ŋ k ə l n ⋉	⋊ f ʊ ŋ k ə l t ⋉
54040	73673	k ɔ n f eː r iː r ə n	k ɔ n f eː r iː r t	konferieren	konferiert	⋊ k ɔ n f eː r iː r ə n ⋉	⋊ k ɔ n f eː r iː r t ⋉
54053	73690	ʃ v ɛ m ə n	g ə ʃ v ɛ m t	schwemmen	geschwemmt	⋊ ʃ v ɛ m ə n ⋉	⋊ ʃ v ɛ m t ⋉
54066	73704	au̯ s ts ɛː l ə n	au̯ s g ə ts ɛː l t	auszaehlen	ausgezaehlt	⋊ a u s ts ɛː l ə n ⋉	⋊ a u s g ə ts ɛː l t ⋉
54083	73724	a n b ə r au̯ m ə n	a n b ə r au̯ m t	anberaumen	anberaumt	⋊ a n b ə r a u m ə n ⋉	⋊ a n b ə r a u m t ⋉
54106	73752	yː b ə r l aː d ə n	yː b ə r l aː d ə n	überladen	überladen	⋊ yː b ə r l aː d ə n ⋉	⋊ yː b ə r l aː d ə n ⋉
54148	73809	t r ɔ k ə n ʃ l oi̯ d ə r n	t r ɔ k ə n g ə ʃ l oi̯ d ə r t	trockenschleudern	trockengeschleudert	⋊ t r ɔ k ə n ʃ l o i d ə r n ⋉	⋊ t r ɔ k ə n g ə ʃ l o i d ə r t ⋉
54152	73813	ai̯ n l a s ə n	ai̯ n g ə l a s ə n	einlassen	eingelassen	⋊ a i n l a s ə n ⋉	⋊ a i n g ə l a s ə n ⋉
54165	73832	b a z iː r ə n	b a z iː r t	basieren	basiert	⋊ b a z iː r ə n ⋉	⋊ b a z iː r t ⋉
54179	73848	d ɛ m ə r n	g ə d ɛ m ə r t	dämmern	gedämmert	⋊ d ɛ m ə r n ⋉	⋊ d ɛ m ə r t ⋉
54239	73936	eː r oː t iː z iː r ə n	eː r oː t iː z iː r t	erotisieren	erotisiert	⋊ eː r oː t iː z iː r ə n ⋉	⋊ eː r oː t iː z iː r t ⋉
54263	73966	k l ɛ k ə n	g ə k l ɛ k t	klecken	gekleckt	⋊ k l ɛ k ə n ⋉	⋊ k l ɛ k t ⋉
54271	73976	v ɛ k r ai̯ s ə n	v ɛ k g ə r ɪ s ə n	wegreissen	weggerissen	⋊ v ɛ k r a i s ə n ⋉	⋊ v ɛ k g ə r ɪ s ə n ⋉
54274	73979	f yː z iː l iː r ə n	f yː z iː l iː r t	füsilieren	füsiliert	⋊ f yː z iː l iː r ə n ⋉	⋊ f yː z iː l iː r t ⋉
54285	73999	a p t r ɔ pf ə n	a p g ə t r ɔ pf t	abtropfen	abgetropft	⋊ a p t r ɔ pf ə n ⋉	⋊ a p g ə t r ɔ pf t ⋉
54289	74004	k ɪ p ə l n	g ə k ɪ p ə l t	kippeln	gekippelt	⋊ k ɪ p ə l n ⋉	⋊ k ɪ p ə l t ⋉
54294	74010	ʊ m a d r ɛ s iː r ə n	ʊ m a d r ɛ s iː r t	umadressieren	umadressiert	⋊ ʊ m a d r ɛ s iː r ə n ⋉	⋊ ʊ m a d r ɛ s iː r t ⋉
54306	74028	au̯ s z iː d ə l n	au̯ s g ə z iː d ə l t	aussiedeln	ausgesiedelt	⋊ a u s z iː d ə l n ⋉	⋊ a u s g ə z iː d ə l t ⋉
54361	74102	f ɔ r t h aː b ə n	f ɔ r t g ə h aː p t	forthaben	fortgehabt	⋊ f ɔ r t h aː b ə n ⋉	⋊ f ɔ r t g ə h aː p t ⋉
54383	74134	ts uː m ɛ s ə n	ts uː g ə m ɛ s ə n	zumessen	zugemessen	⋊ ts uː m ɛ s ə n ⋉	⋊ ts uː g ə m ɛ s ə n ⋉
54384	74136	ɛ n t ə r n	g ə ɛ n t ə r t	entern	geentert	⋊ ɛ n t ə r n ⋉	⋊ ɛ n t ə r t ⋉
54449	74224	ai̯ n v ɛ r t s g eː ə n	ai̯ n v ɛ r t s g ə g a ŋ ə n	einwärtsgehen	einwärtsgegangen	⋊ a i n v ɛ r t s g eː ə n ⋉	⋊ a i n v ɛ r t s g ə g a ŋ ə n ⋉
54486	74277	f ɛ r h aː k ə n	f ɛ r h aː k t	verhaken	verhakt	⋊ f ɛ r h aː k ə n ⋉	⋊ f ɛ r h aː k t ⋉
54487	74278	au̯ f ʃ au̯ k ə l n	au̯ f g ə ʃ au̯ k ə l t	aufschaukeln	aufgeschaukelt	⋊ a u f ʃ a u k ə l n ⋉	⋊ a u f g ə ʃ a u k ə l t ⋉
54488	74279	ʃ t a r ə n	g ə ʃ t a r t	starren	gestarrt	⋊ ʃ t a r ə n ⋉	⋊ ʃ t a r t ⋉
54494	74287	au̯ s k n ɪ p s ə n	au̯ s g ə k n ɪ p s t	ausknipsen	ausgeknipst	⋊ a u s k n ɪ p s ə n ⋉	⋊ a u s g ə k n ɪ p s t ⋉
54496	74289	f oː r a n k ɔ m ə n	f oː r a n g ə k ɔ m ə n	vorankommen	vorangekommen	⋊ f oː r a n k ɔ m ə n ⋉	⋊ f oː r a n g ə k ɔ m ə n ⋉
54502	74297	b ə k l aː g ə n	b ə k l aː k t	beklagen	beklagt	⋊ b ə k l aː g ə n ⋉	⋊ b ə k l aː k t ⋉
54503	74298	s ts ɪ n t ɪ l iː r ə n	s ts ɪ n t ɪ l iː r t	szintillieren	szintilliert	⋊ s ts ɪ n t ɪ l iː r ə n ⋉	⋊ s ts ɪ n t ɪ l iː r t ⋉
54523	74325	ʊ m h eː r l iː g ə n	ʊ m h eː r g ə l eː g ə n	umherliegen	umhergelegen	⋊ ʊ m h eː r l iː g ə n ⋉	⋊ ʊ m h eː r g ə l eː g ə n ⋉
54533	74341	a p r eː b ə l n	a p g ə r eː b ə l t	abrebeln	abgerebelt	⋊ a p r eː b ə l n ⋉	⋊ a p g ə r eː b ə l t ⋉
54542	74353	a p h ɔ r x ə n	a p g ə h ɔ r ç t	abhorchen	abgehorcht	⋊ a p h ɔ r x ə n ⋉	⋊ a p g ə h ɔ r ç t ⋉
54545	74359	r eː p r oː d uː ts iː r ə n	r eː p r oː d uː ts iː r t	reproduzieren	reproduziert	⋊ r eː p r oː d uː ts iː r ə n ⋉	⋊ r eː p r oː d uː ts iː r t ⋉
54548	74362	f ɛ r g ɪ f t ə n	f ɛ r g ɪ f t ə t	vergiften	vergiftet	⋊ f ɛ r g ɪ f t ə n ⋉	⋊ f ɛ r g ɪ f t ə t ⋉
54557	74375	g a k ə r n	g ə g a k ə r t	gackern	gegackert	⋊ g a k ə r n ⋉	⋊ g a k ə r t ⋉
54592	74424	h eː r f a l ə n	h eː r g ə f a l ə n	herfallen	hergefallen	⋊ h eː r f a l ə n ⋉	⋊ h eː r g ə f a l ə n ⋉
54616	74455	ɛ n t m a g n eː t iː z iː r ə n	ɛ n t m a g n eː t iː z iː r t	entmagnetisieren	entmagnetisiert	⋊ ɛ n t m a g n eː t iː z iː r ə n ⋉	⋊ ɛ n t m a g n eː t iː z iː r t ⋉
54638	74487	ɛ n t v ɛ s ə r n	ɛ n t v ɛ s ə r t	entwässern	entwässert	⋊ ɛ n t v ɛ s ə r n ⋉	⋊ ɛ n t v ɛ s ə r t ⋉
54655	74517	v ai̯ t ə r m a x ə n	v ai̯ t ə r g ə m a x t	weitermachen	weitergemacht	⋊ v a i t ə r m a x ə n ⋉	⋊ v a i t ə r g ə m a x t ⋉
54679	74549	v ai̯ t ə r f l iː g ə n	v ai̯ t ə r g ə f l oː g ə n	weiterfliegen	weitergeflogen	⋊ v a i t ə r f l iː g ə n ⋉	⋊ v a i t ə r g ə f l oː g ə n ⋉
54687	74564	v iː ə r n	g ə v iː ə r t	wiehern	gewiehert	⋊ v iː ə r n ⋉	⋊ v iː ə r t ⋉
54706	74591	yː b ə r r ai̯ ts ə n	yː b ə r r ai̯ ts t	überreizen	überreizt	⋊ yː b ə r r a i ts ə n ⋉	⋊ yː b ə r r a i ts t ⋉
54789	74698	v ai̯ t ə r f ɛ r m ɪ t ə l n	v ai̯ t ə r f ɛ r m ɪ t ə l t	weitervermitteln	weitervermittelt	⋊ v a i t ə r f ɛ r m ɪ t ə l n ⋉	⋊ v a i t ə r f ɛ r m ɪ t ə l t ⋉
54797	74706	a n ʃ t ɪ m ə n	a n g ə ʃ t ɪ m t	anstimmen	angestimmt	⋊ a n ʃ t ɪ m ə n ⋉	⋊ a n g ə ʃ t ɪ m t ⋉
54798	74708	ɛ r k yː n ə n	ɛ r k yː n t	erkühnen	erkühnt	⋊ ɛ r k yː n ə n ⋉	⋊ ɛ r k yː n t ⋉
54812	74732	b r au̯ x ə n	g ə b r au̯ x t	brauchen	gebraucht	⋊ b r a u x ə n ⋉	⋊ b r a u x t ⋉
54814	74734	r au̯ f ə n	g ə r au̯ f t	raufen	gerauft	⋊ r a u f ə n ⋉	⋊ r a u f t ⋉
54874	74817	au̯ f p ɛ p ə l n	au̯ f g ə p ɛ p ə l t	aufpäppeln	aufgepäppelt	⋊ a u f p ɛ p ə l n ⋉	⋊ a u f g ə p ɛ p ə l t ⋉
54887	74833	h ɪ n z iː x ə n	h ɪ n g ə z iː x t	hinsiechen	hingesiecht	⋊ h ɪ n z iː x ə n ⋉	⋊ h ɪ n g ə z iː x t ⋉
54898	74848	m ɛ ts ə n	g ə m ɛ ts t	metzen	gemetzt	⋊ m ɛ ts ə n ⋉	⋊ m ɛ ts t ⋉
54934	74893	z ɛ k s uː a l iː z iː r ə n	z ɛ k s uː a l iː z iː r t	sexualisieren	sexualisiert	⋊ z ɛ k s uː a l iː z iː r ə n ⋉	⋊ z ɛ k s uː a l iː z iː r t ⋉
54953	74914	f ɛ r ʃ t ɛ l ə n	f ɛ r ʃ t ɛ l t	verstellen	verstellt	⋊ f ɛ r ʃ t ɛ l ə n ⋉	⋊ f ɛ r ʃ t ɛ l t ⋉
54960	74926	aː t m ə n	g ə aː t m ə t	atmen	geatmet	⋊ aː t m ə n ⋉	⋊ aː t m ə t ⋉
54972	74947	ai̯ n ʃ p ɪ n ə n	ai̯ n g ə ʃ p ɔ n ə n	einspinnen	eingesponnen	⋊ a i n ʃ p ɪ n ə n ⋉	⋊ a i n g ə ʃ p ɔ n ə n ⋉
54991	74969	ʃ t ɪ l l eː g ə n	ʃ t ɪ l g ə l eː k t	stillegen	stillgelegt	⋊ ʃ t ɪ l l eː g ə n ⋉	⋊ ʃ t ɪ l g ə l eː k t ⋉
55035	75023	r eː k ɔ n v a l ɛ s ts iː r ə n	r eː k ɔ n v a l ɛ s ts iː r t	rekonvaleszieren	rekonvalesziert	⋊ r eː k ɔ n v a l ɛ s ts iː r ə n ⋉	⋊ r eː k ɔ n v a l ɛ s ts iː r t ⋉
55049	75045	t yː p ə n	g ə t yː p t	typen	getypt	⋊ t yː p ə n ⋉	⋊ t yː p t ⋉
55085	75088	k l a m yː z ə r n	g ə k l a m yː z ə r t	klamüsern	geklamüsert	⋊ k l a m yː z ə r n ⋉	⋊ k l a m yː z ə r t ⋉
55138	75166	m ɪ ʃ ə n	g ə m ɪ ʃ t	mischen	gemischt	⋊ m ɪ ʃ ə n ⋉	⋊ m ɪ ʃ t ⋉
55151	75185	ʃ p ai̯ z ə n	g ə ʃ p ai̯ s t	speisen	gespeist	⋊ ʃ p a i z ə n ⋉	⋊ ʃ p a i s t ⋉
55155	75190	b a s t a r d iː r ə n	b a s t a r d iː r t	bastardieren	bastardiert	⋊ b a s t a r d iː r ə n ⋉	⋊ b a s t a r d iː r t ⋉
55170	75207	d ʊ r ç t r ɛ n iː r ə n	d ʊ r ç t r ɛ n iː r t	durchtrainieren	durchtrainiert	⋊ d ʊ r ç t r ɛ n iː r ə n ⋉	⋊ d ʊ r ç t r ɛ n iː r t ⋉
55196	75245	a n g ə l oː b ə n	a n g ə l oː p t	angeloben	angelobt	⋊ a n g ə l oː b ə n ⋉	⋊ a n g ə l oː p t ⋉
55205	75257	ɛ n t k r a m pf ə n	ɛ n t k r a m pf t	entkrampfen	entkrampft	⋊ ɛ n t k r a m pf ə n ⋉	⋊ ɛ n t k r a m pf t ⋉
55210	75265	b ə ʃ t ɪ m ə n	b ə ʃ t ɪ m t	bestimmen	bestimmt	⋊ b ə ʃ t ɪ m ə n ⋉	⋊ b ə ʃ t ɪ m t ⋉
55218	75274	r eː m ɔ n t iː r ə n	r eː m ɔ n t iː r t	remontieren	remontiert	⋊ r eː m ɔ n t iː r ə n ⋉	⋊ r eː m ɔ n t iː r t ⋉
55221	75278	ʊ m ʃ ʊ l d ə n	ʊ m g ə ʃ ʊ l d ə t	umschulden	umgeschuldet	⋊ ʊ m ʃ ʊ l d ə n ⋉	⋊ ʊ m g ə ʃ ʊ l d ə t ⋉
55227	75286	ʊ m pf l yː g ə n	ʊ m g ə pf l yː k t	umpflügen	umgepflügt	⋊ ʊ m pf l yː g ə n ⋉	⋊ ʊ m g ə pf l yː k t ⋉
55239	75309	h øː r ə n	g ə h øː r t	hören	gehört	⋊ h øː r ə n ⋉	⋊ h øː r t ⋉
55255	75328	t r iː ʊ m f iː r ə n	t r iː ʊ m f iː r t	triumphieren	triumphiert	⋊ t r iː ʊ m f iː r ə n ⋉	⋊ t r iː ʊ m f iː r t ⋉
55264	75341	d ʊ r ç v a x ə n	d ʊ r ç v a x t	durchwachen	durchwacht	⋊ d ʊ r ç v a x ə n ⋉	⋊ d ʊ r ç v a x t ⋉
55282	75369	m iː k r oː s k oː p iː r ə n	m iː k r oː s k oː p iː r t	mikroskopieren	mikroskopiert	⋊ m iː k r oː s k oː p iː r ə n ⋉	⋊ m iː k r oː s k oː p iː r t ⋉
55283	75370	r a t ʃ l aː g ə n	g ə r a t ʃ l aː k t	ratschlagen	geratschlagt	⋊ r a t ʃ l aː g ə n ⋉	⋊ r a t ʃ l aː k t ⋉
55298	75394	ts ɛ r z ɛː g ə n	ts ɛ r z ɛː k t	zersägen	zersägt	⋊ ts ɛ r z ɛː g ə n ⋉	⋊ ts ɛ r z ɛː k t ⋉
55312	75411	k uː h a n d ə l n	g ə k uː h a n d ə l t	kuhhandeln	gekuhhandelt	⋊ k uː h a n d ə l n ⋉	⋊ k uː h a n d ə l t ⋉
55322	75422	f a x ə n	g ə f a x t	fachen	gefacht	⋊ f a x ə n ⋉	⋊ f a x t ⋉
55431	75561	ʊ m h eː r ʃ v ai̯ f ə n	ʊ m h eː r g ə ʃ v ai̯ f t	umherschweifen	umhergeschweift	⋊ ʊ m h eː r ʃ v a i f ə n ⋉	⋊ ʊ m h eː r g ə ʃ v a i f t ⋉
55455	75591	f ɛ r b r yː ə n	f ɛ r b r yː t	verbrühen	verbrüht	⋊ f ɛ r b r yː ə n ⋉	⋊ f ɛ r b r yː t ⋉
55502	75661	d ʊ r ç f oi̯ x t ə n	d ʊ r ç f oi̯ x t ə t	durchfeuchten	durchfeuchtet	⋊ d ʊ r ç f o i x t ə n ⋉	⋊ d ʊ r ç f o i x t ə t ⋉
55503	75662	ɛ r f ʏ l ə n	ɛ r f ʏ l t	erfüllen	erfüllt	⋊ ɛ r f ʏ l ə n ⋉	⋊ ɛ r f ʏ l t ⋉
55530	75697	v ɪ n t ə r n	g ə v ɪ n t ə r t	wintern	gewintert	⋊ v ɪ n t ə r n ⋉	⋊ v ɪ n t ə r t ⋉
55531	75699	f ɛ r a n ʃ au̯ l ɪ x ə n	f ɛ r a n ʃ au̯ l ɪ ç t	veranschaulichen	veranschaulicht	⋊ f ɛ r a n ʃ a u l ɪ x ə n ⋉	⋊ f ɛ r a n ʃ a u l ɪ ç t ⋉
55541	75711	ts iː g ə l n	g ə ts iː g ə l t	ziegeln	geziegelt	⋊ ts iː g ə l n ⋉	⋊ ts iː g ə l t ⋉
55572	75752	a n f a l ə n	a n g ə f a l ə n	anfallen	angefallen	⋊ a n f a l ə n ⋉	⋊ a n g ə f a l ə n ⋉
55622	75819	d ʊ r ç f ai̯ ə r n	d ʊ r ç f ai̯ ə r t	durchfeiern	durchfeiert	⋊ d ʊ r ç f a i ə r n ⋉	⋊ d ʊ r ç f a i ə r t ⋉
55677	75897	yː b ə r ʃ p iː l ə n	yː b ə r ʃ p iː l t	überspielen	überspielt	⋊ yː b ə r ʃ p iː l ə n ⋉	⋊ yː b ə r ʃ p iː l t ⋉
55698	75931	a r g uː m ɛ n t iː r ə n	a r g uː m ɛ n t iː r t	argumentieren	argumentiert	⋊ a r g uː m ɛ n t iː r ə n ⋉	⋊ a r g uː m ɛ n t iː r t ⋉
55717	75957	yː b ə r v iː g ə n	yː b ə r g ə v oː g ə n	überwiegen	übergewogen	⋊ yː b ə r v iː g ə n ⋉	⋊ yː b ə r g ə v oː g ə n ⋉
55719	75959	iː n iː t iː iː r ə n	iː n iː t iː iː r t	initiieren	initiiert	⋊ iː n iː t iː iː r ə n ⋉	⋊ iː n iː t iː iː r t ⋉
55725	75969	au̯ s f ɛ r t ɪ g ə n	au̯ s g ə f ɛ r t ɪ ç t	ausfertigen	ausgefertigt	⋊ a u s f ɛ r t ɪ g ə n ⋉	⋊ a u s g ə f ɛ r t ɪ ç t ⋉
55736	75983	t r ɔ k n ə n	g ə t r ɔ k n ə t	trocknen	getrocknet	⋊ t r ɔ k n ə n ⋉	⋊ t r ɔ k n ə t ⋉
55763	76023	a p h ɔ l ts ə n	a p g ə h ɔ l ts t	abholzen	abgeholzt	⋊ a p h ɔ l ts ə n ⋉	⋊ a p g ə h ɔ l ts t ⋉
55805	76079	n aː x ʃ au̯ ə n	n aː x g ə ʃ au̯ t	nachschauen	nachgeschaut	⋊ n aː x ʃ a u ə n ⋉	⋊ n aː x g ə ʃ a u t ⋉
55812	76087	g l ʊ k ə r n	g ə g l ʊ k ə r t	gluckern	gegluckert	⋊ g l ʊ k ə r n ⋉	⋊ g l ʊ k ə r t ⋉
55827	76107	b ə f r ɪ s t ə n	b ə f r ɪ s t ə t	befristen	befristet	⋊ b ə f r ɪ s t ə n ⋉	⋊ b ə f r ɪ s t ə t ⋉
55829	76109	f ɛ r k n œ x ə r n	f ɛ r k n œ x ə r t	verknöchern	verknöchert	⋊ f ɛ r k n œ x ə r n ⋉	⋊ f ɛ r k n œ x ə r t ⋉
55840	76127	ts ɛ n t r iː f uː g iː r ə n	ts ɛ n t r iː f uː g iː r t	zentrifugieren	zentrifugiert	⋊ ts ɛ n t r iː f uː g iː r ə n ⋉	⋊ ts ɛ n t r iː f uː g iː r t ⋉
55862	76151	f ɛ r ʃ m ɛ l ts ə n	f ɛ r ʃ m ɔ l ts ə n	verschmelzen	verschmolzen	⋊ f ɛ r ʃ m ɛ l ts ə n ⋉	⋊ f ɛ r ʃ m ɔ l ts ə n ⋉
55879	76176	f ɛ r k n a s t ə n	f ɛ r k n a s t ə t	verknasten	verknastet	⋊ f ɛ r k n a s t ə n ⋉	⋊ f ɛ r k n a s t ə t ⋉
55905	76213	v ai̯ l ə n	g ə v ai̯ l t	weilen	geweilt	⋊ v a i l ə n ⋉	⋊ v a i l t ⋉
55913	76224	f ɛ r b l a s ə n	f ɛ r b l a s t	verblassen	verblasst	⋊ f ɛ r b l a s ə n ⋉	⋊ f ɛ r b l a s t ⋉
55915	76227	a p v a ʃ ə n	a p g ə v a ʃ ə n	abwaschen	abgewaschen	⋊ a p v a ʃ ə n ⋉	⋊ a p g ə v a ʃ ə n ⋉
55917	76229	ɛ r n ɛ n ə n	ɛ r n a n t	ernennen	ernannt	⋊ ɛ r n ɛ n ə n ⋉	⋊ ɛ r n a n t ⋉
55922	76237	a p ts aː l ə n	a p g ə ts aː l t	abzahlen	abgezahlt	⋊ a p ts aː l ə n ⋉	⋊ a p g ə ts aː l t ⋉
55928	76246	a n ʃ t r ɛ ŋ ə n	a n g ə ʃ t r ɛ ŋ t	ansträngen	angesträngt	⋊ a n ʃ t r ɛ ŋ ə n ⋉	⋊ a n g ə ʃ t r ɛ ŋ t ⋉
55963	76290	yː b ə r z eː ə n	yː b ə r g ə z eː ə n	übersehen	übergesehen	⋊ yː b ə r z eː ə n ⋉	⋊ yː b ə r g ə z eː ə n ⋉
55968	76296	a p m eː r ə n	a p g ə m eː r t	abmehren	abgemehrt	⋊ a p m eː r ə n ⋉	⋊ a p g ə m eː r t ⋉
55972	76301	p ʊ p ə n	g ə p ʊ p t	puppen	gepuppt	⋊ p ʊ p ə n ⋉	⋊ p ʊ p t ⋉
55982	76317	f ɔ r t r ai̯ s ə n	f ɔ r t g ə r ɪ s ə n	fortreissen	fortgerissen	⋊ f ɔ r t r a i s ə n ⋉	⋊ f ɔ r t g ə r ɪ s ə n ⋉
55983	76318	ʃ m ai̯ x ə l n	g ə ʃ m ai̯ x ə l t	schmeicheln	geschmeichelt	⋊ ʃ m a i x ə l n ⋉	⋊ ʃ m a i x ə l t ⋉
55990	76327	p l uː d ə r n	g ə p l uː d ə r t	pludern	gepludert	⋊ p l uː d ə r n ⋉	⋊ p l uː d ə r t ⋉
55993	76331	g ə n yː g ə n	g ə n yː k t	genügen	genügt	⋊ g ə n yː g ə n ⋉	⋊ n yː k t ⋉
56007	76351	k ɛ n t ə r n	g ə k ɛ n t ə r t	kentern	gekentert	⋊ k ɛ n t ə r n ⋉	⋊ k ɛ n t ə r t ⋉
56014	76364	ɛ r r ɛ x n ə n	ɛ r r ɛ x n ə t	errechnen	errechnet	⋊ ɛ r r ɛ x n ə n ⋉	⋊ ɛ r r ɛ x n ə t ⋉
56030	76384	k n ʊ r ə n	g ə k n ʊ r t	knurren	geknurrt	⋊ k n ʊ r ə n ⋉	⋊ k n ʊ r t ⋉
56061	76428	h oi̯ f ə n	g ə h oi̯ f t	häufen	gehäuft	⋊ h o i f ə n ⋉	⋊ h o i f t ⋉
56078	76448	au̯ s v ɪ t ə r n	au̯ s g ə v ɪ t ə r t	auswittern	ausgewittert	⋊ a u s v ɪ t ə r n ⋉	⋊ a u s g ə v ɪ t ə r t ⋉
56097	76471	n iː d ə r m ɛː ə n	n iː d ə r g ə m ɛː t	niedermaehen	niedergemaeht	⋊ n iː d ə r m ɛː ə n ⋉	⋊ n iː d ə r g ə m ɛː t ⋉
56134	76521	f oː r v ɛ r t s k ɔ m ə n	f oː r v ɛ r t s g ə k ɔ m ə n	vorwärtskommen	vorwärtsgekommen	⋊ f oː r v ɛ r t s k ɔ m ə n ⋉	⋊ f oː r v ɛ r t s g ə k ɔ m ə n ⋉
56160	76556	ɛ n t l a ŋ l au̯ f ə n	ɛ n t l a ŋ g ə l au̯ f ə n	entlanglaufen	entlanggelaufen	⋊ ɛ n t l a ŋ l a u f ə n ⋉	⋊ ɛ n t l a ŋ g ə l a u f ə n ⋉
56182	76589	f l ɔ t iː r ə n	f l ɔ t iː r t	flottieren	flottiert	⋊ f l ɔ t iː r ə n ⋉	⋊ f l ɔ t iː r t ⋉
56191	76604	d ʏ r s t ə n	g ə d ʏ r s t ə t	dürsten	gedürstet	⋊ d ʏ r s t ə n ⋉	⋊ d ʏ r s t ə t ⋉
56228	76647	p r oː f ɛ s iː oː n a l iː z iː r ə n	p r oː f ɛ s iː oː n a l iː z iː r t	professionalisieren	professionalisiert	⋊ p r oː f ɛ s iː oː n a l iː z iː r ə n ⋉	⋊ p r oː f ɛ s iː oː n a l iː z iː r t ⋉
56244	76669	f ɛ r m ɪ s ə n	f ɛ r m ɪ s t	vermissen	vermisst	⋊ f ɛ r m ɪ s ə n ⋉	⋊ f ɛ r m ɪ s t ⋉
56287	76722	ɔ r g a n iː z iː r ə n	ɔ r g a n iː z iː r t	organisieren	organisiert	⋊ ɔ r g a n iː z iː r ə n ⋉	⋊ ɔ r g a n iː z iː r t ⋉
56289	76724	a p ʃ v ɪ r ə n	a p g ə ʃ v ɪ r t	abschwirren	abgeschwirrt	⋊ a p ʃ v ɪ r ə n ⋉	⋊ a p g ə ʃ v ɪ r t ⋉
56343	76795	ts uː r ʏ k ʃ au̯ ə n	ts uː r ʏ k g ə ʃ au̯ t	zurückschauen	zurückgeschaut	⋊ ts uː r ʏ k ʃ a u ə n ⋉	⋊ ts uː r ʏ k g ə ʃ a u t ⋉
56352	76810	yː b ə r k l ai̯ d ə n	yː b ə r k l ai̯ d ə t	überkleiden	überkleidet	⋊ yː b ə r k l a i d ə n ⋉	⋊ yː b ə r k l a i d ə t ⋉
56354	76813	yː b ə r z ɛ ts ə n	yː b ə r g ə z ɛ ts t	übersetzen	übergesetzt	⋊ yː b ə r z ɛ ts ə n ⋉	⋊ yː b ə r g ə z ɛ ts t ⋉
56359	76819	a n t r aː g ə n	a n g ə t r aː g ə n	antragen	angetragen	⋊ a n t r aː g ə n ⋉	⋊ a n g ə t r aː g ə n ⋉
56389	76854	b ə ʃ v ɪ n d ə l n	b ə ʃ v ɪ n d ə l t	beschwindeln	beschwindelt	⋊ b ə ʃ v ɪ n d ə l n ⋉	⋊ b ə ʃ v ɪ n d ə l t ⋉
56445	76924	ai̯ n ts ai̯ x n ə n	ai̯ n g ə ts ai̯ x n ə t	einzeichnen	eingezeichnet	⋊ a i n ts a i x n ə n ⋉	⋊ a i n g ə ts a i x n ə t ⋉
56527	77035	f ɛ r r a m ə n	f ɛ r r a m t	verrammen	verrammt	⋊ f ɛ r r a m ə n ⋉	⋊ f ɛ r r a m t ⋉
56537	77049	p l a ts iː r ə n	p l a ts iː r t	placieren	placiert	⋊ p l a ts iː r ə n ⋉	⋊ p l a ts iː r t ⋉
56581	77105	au̯ f pf l a n ts ə n	au̯ f g ə pf l a n ts t	aufpflanzen	aufgepflanzt	⋊ a u f pf l a n ts ə n ⋉	⋊ a u f g ə pf l a n ts t ⋉
56597	77127	a n t r au̯ ə n	a n g ə t r au̯ t	antrauen	angetraut	⋊ a n t r a u ə n ⋉	⋊ a n g ə t r a u t ⋉
56624	77161	a n l uː v ə n	a n g ə l uː f t	anluven	angeluvt	⋊ a n l uː v ə n ⋉	⋊ a n g ə l uː f t ⋉
56630	77172	h ɔ l p ə r n	g ə h ɔ l p ə r t	holpern	geholpert	⋊ h ɔ l p ə r n ⋉	⋊ h ɔ l p ə r t ⋉
56712	77280	f ɛ r f yː r ə n	f ɛ r f yː r t	verführen	verführt	⋊ f ɛ r f yː r ə n ⋉	⋊ f ɛ r f yː r t ⋉
56714	77282	ʃ p r eː ə n	g ə ʃ p r eː t	sprayen	gesprayt	⋊ ʃ p r eː ə n ⋉	⋊ ʃ p r eː t ⋉
56725	77301	ɛ r z eː n ə n	ɛ r z eː n t	ersehnen	ersehnt	⋊ ɛ r z eː n ə n ⋉	⋊ ɛ r z eː n t ⋉
56781	77371	p r a s ə n	g ə p r a s t	prassen	geprasst	⋊ p r a s ə n ⋉	⋊ p r a s t ⋉
56798	77390	ɛ n t m yː t iː z iː r ə n	ɛ n t m yː t iː z iː r t	entmythisieren	entmythisiert	⋊ ɛ n t m yː t iː z iː r ə n ⋉	⋊ ɛ n t m yː t iː z iː r t ⋉
56826	77426	b ə ʃ v øː r ə n	b ə ʃ v oː r ə n	beschwören	beschworen	⋊ b ə ʃ v øː r ə n ⋉	⋊ b ə ʃ v oː r ə n ⋉
56842	77454	b ə r a p ə n	b ə r a p t	berappen	berappt	⋊ b ə r a p ə n ⋉	⋊ b ə r a p t ⋉
56847	77464	b œ r d ə l n	g ə b œ r d ə l t	bördeln	gebördelt	⋊ b œ r d ə l n ⋉	⋊ b œ r d ə l t ⋉
56853	77470	b ə n aː x r ɪ ç t ɪ g ə n	b ə n aː x r ɪ ç t ɪ ç t	benachrichtigen	benachrichtigt	⋊ b ə n aː x r ɪ ç t ɪ g ə n ⋉	⋊ b ə n aː x r ɪ ç t ɪ ç t ⋉
56854	77471	k l aː r v eː r d ə n	k l aː r g ə v ɔ r d ə n	klarwerden	klargeworden	⋊ k l aː r v eː r d ə n ⋉	⋊ k l aː r g ə v ɔ r d ə n ⋉
56874	77494	g l au̯ b ə n	g ə g l au̯ p t	glauben	geglaubt	⋊ g l a u b ə n ⋉	⋊ g l a u p t ⋉
56885	77508	a p k ɪ p ə n	a p g ə k ɪ p t	abkippen	abgekippt	⋊ a p k ɪ p ə n ⋉	⋊ a p g ə k ɪ p t ⋉
56937	77572	ʊ n t ə r r yː r ə n	ʊ n t ə r g ə r yː r t	unterrühren	untergerührt	⋊ ʊ n t ə r r yː r ə n ⋉	⋊ ʊ n t ə r g ə r yː r t ⋉
56992	77658	h ʊ n ts ə n	g ə h ʊ n ts t	hunzen	gehunzt	⋊ h ʊ n ts ə n ⋉	⋊ h ʊ n ts t ⋉
57018	77688	a n b a l iː r ə n	a n b a l iː r t	emballieren	emballiert	⋊ a n b a l iː r ə n ⋉	⋊ a n b a l iː r t ⋉
57044	77724	f ɛ r ts øː g ə r n	f ɛ r ts øː g ə r t	verzögern	verzögert	⋊ f ɛ r ts øː g ə r n ⋉	⋊ f ɛ r ts øː g ə r t ⋉
57067	77754	h ɛ r b ɛ r g ə n	g ə h ɛ r b ɛ r k t	herbergen	geherbergt	⋊ h ɛ r b ɛ r g ə n ⋉	⋊ h ɛ r b ɛ r k t ⋉
57130	77833	ɛ n t g eː g ə n z eː ə n	ɛ n t g eː g ə n g ə z eː n	entgegensehen	entgegengesehn	⋊ ɛ n t g eː g ə n z eː ə n ⋉	⋊ ɛ n t g eː g ə n g ə z eː n ⋉
57155	77859	f ɛ r ts iː ə n	f ɛ r ts oː g ə n	verziehen	verzogen	⋊ f ɛ r ts iː ə n ⋉	⋊ f ɛ r ts oː g ə n ⋉
57162	77868	f oː r b ai̯ f yː r ə n	f oː r b ai̯ g ə f yː r t	vorbeiführen	vorbeigeführt	⋊ f oː r b a i f yː r ə n ⋉	⋊ f oː r b a i g ə f yː r t ⋉
57164	77871	g ə r ɪ ŋ a x t ə n	g ə r ɪ ŋ g ə a x t ə t	geringachten	geringgeachtet	⋊ g ə r ɪ ŋ a x t ə n ⋉	⋊ r ɪ ŋ g ə a x t ə t ⋉
57165	77872	n eː b ə n ai̯ n a n d ə r ʃ a l t ə n	n eː b ə n ai̯ n a n d ə r g ə ʃ a l t ə t	nebeneinanderschalten	nebeneinandergeschaltet	⋊ n eː b ə n a i n a n d ə r ʃ a l t ə n ⋉	⋊ n eː b ə n a i n a n d ə r g ə ʃ a l t ə t ⋉
57176	77887	d eː m ɔ n s t r iː r ə n	d eː m ɔ n s t r iː r t	demonstrieren	demonstriert	⋊ d eː m ɔ n s t r iː r ə n ⋉	⋊ d eː m ɔ n s t r iː r t ⋉
57185	77897	a n t iː ʃ a m b r iː r ə n	a n t iː ʃ a m b r iː r t	antichambrieren	antichambriert	⋊ a n t iː ʃ a m b r iː r ə n ⋉	⋊ a n t iː ʃ a m b r iː r t ⋉
57189	77903	b ə n aː g ə n	b ə n aː k t	benagen	benagt	⋊ b ə n aː g ə n ⋉	⋊ b ə n aː k t ⋉
57191	77905	ʊ m g eː b ə n	ʊ m g eː b ə n	umgeben	umgeben	⋊ ʊ m g eː b ə n ⋉	⋊ ʊ m g eː b ə n ⋉
57260	78002	pf l ʏ k ə n	g ə pf l ʏ k t	pflücken	gepflückt	⋊ pf l ʏ k ə n ⋉	⋊ pf l ʏ k t ⋉
57283	78034	f l ɔ t m a x ə n	f l ɔ t g ə m a x t	flottmachen	flottgemacht	⋊ f l ɔ t m a x ə n ⋉	⋊ f l ɔ t g ə m a x t ⋉
57285	78037	ts uː r ʏ k r uː f ə n	ts uː r ʏ k g ə r uː f ə n	zurückrufen	zurückgerufen	⋊ ts uː r ʏ k r uː f ə n ⋉	⋊ ts uː r ʏ k g ə r uː f ə n ⋉
57293	78048	h ai̯ m k eː r ə n	h ai̯ m g ə k eː r t	heimkehren	heimgekehrt	⋊ h a i m k eː r ə n ⋉	⋊ h a i m g ə k eː r t ⋉
57319	78082	ai̯ n f yː g ə n	ai̯ n g ə f yː k t	einfügen	eingefügt	⋊ a i n f yː g ə n ⋉	⋊ a i n g ə f yː k t ⋉
