level_0	index	wordform1	wordform2	wordform1_orth	wordform2_orth	stem	output
16135	22052	f ɔ r t l eː b ə n	f ɔ r t g ə l eː p t	fortleben	fortgelebt	⋊ f ɔ r t l eː b ə n ⋉	⋊ f ɔ r t g ə l eː p t ⋉
16151	22080	au̯ f t r ai̯ b ə n	au̯ f g ə t r iː b ə n	auftreiben	aufgetrieben	⋊ a u f t r a i b ə n ⋉	⋊ a u f g ə t r iː b ə n ⋉
16154	22085	k n ɔ s p ə n	g ə k n ɔ s p t	knospen	geknospt	⋊ k n ɔ s p ə n ⋉	⋊ k n ɔ s p t ⋉
16156	22089	k v a s ə l n	g ə k v a s ə l t	quasseln	gequasselt	⋊ k v a s ə l n ⋉	⋊ k v a s ə l t ⋉
16175	22114	b ai̯ ʃ p r ɪ ŋ ə n	b ai̯ g ə ʃ p r ʊ ŋ ə n	beispringen	beigesprungen	⋊ b a i ʃ p r ɪ ŋ ə n ⋉	⋊ b a i g ə ʃ p r ʊ ŋ ə n ⋉
16184	22129	v a b ə l n	g ə v a b ə l t	wabbeln	gewabbelt	⋊ v a b ə l n ⋉	⋊ v a b ə l t ⋉
16188	22133	k ɔ ts ə n	g ə k ɔ ts t	kotzen	gekotzt	⋊ k ɔ ts ə n ⋉	⋊ k ɔ ts t ⋉
16213	22162	oi̯ g ə l n	g ə oi̯ g ə l t	äugeln	geäugelt	⋊ o i g ə l n ⋉	⋊ o i g ə l t ⋉
16217	22168	ɛ r ʃ t ai̯ g ə n	ɛ r ʃ t iː g ə n	ersteigen	erstiegen	⋊ ɛ r ʃ t a i g ə n ⋉	⋊ ɛ r ʃ t iː g ə n ⋉
16219	22170	au̯ f l ɪ s t ə n	au̯ f g ə l ɪ s t ə t	auflisten	aufgelistet	⋊ a u f l ɪ s t ə n ⋉	⋊ a u f g ə l ɪ s t ə t ⋉
16244	22204	k n eː b ə l n	g ə k n eː b ə l t	knebeln	geknebelt	⋊ k n eː b ə l n ⋉	⋊ k n eː b ə l t ⋉
16275	22239	z eː d iː m ɛ n t iː r ə n	z eː d iː m ɛ n t iː r t	sedimentieren	sedimentiert	⋊ z eː d iː m ɛ n t iː r ə n ⋉	⋊ z eː d iː m ɛ n t iː r t ⋉
16333	22318	t a m b uː r iː r ə n	t a m b uː r iː r t	tamburieren	tamburiert	⋊ t a m b uː r iː r ə n ⋉	⋊ t a m b uː r iː r t ⋉
16365	22367	au̯ f t r ʊ m pf ə n	au̯ f g ə t r ʊ m pf t	auftrumpfen	aufgetrumpft	⋊ a u f t r ʊ m pf ə n ⋉	⋊ a u f g ə t r ʊ m pf t ⋉
16368	22372	t ɪ p ə l n	g ə t ɪ p ə l t	tippeln	getippelt	⋊ t ɪ p ə l n ⋉	⋊ t ɪ p ə l t ⋉
16369	22373	yː b ə r r ɔ l ə n	yː b ə r r ɔ l t	überrollen	überrollt	⋊ yː b ə r r ɔ l ə n ⋉	⋊ yː b ə r r ɔ l t ⋉
16408	22424	a p t r ɛ n ə n	a p g ə t r ɛ n t	abtrennen	abgetrennt	⋊ a p t r ɛ n ə n ⋉	⋊ a p g ə t r ɛ n t ⋉
16434	22460	b ə ts v ai̯ f ə l n	b ə ts v ai̯ f ə l t	bezweifeln	bezweifelt	⋊ b ə ts v a i f ə l n ⋉	⋊ b ə ts v a i f ə l t ⋉
16472	22515	au̯ s z øː n ə n	au̯ s g ə z øː n t	aussöhnen	ausgesöhnt	⋊ a u s z øː n ə n ⋉	⋊ a u s g ə z øː n t ⋉
16497	22555	d ʊ r ç d r ɪ ŋ ə n	d ʊ r ç d r ʊ ŋ ə n	durchdringen	durchdrungen	⋊ d ʊ r ç d r ɪ ŋ ə n ⋉	⋊ d ʊ r ç d r ʊ ŋ ə n ⋉
16530	22603	a r iː v iː r ə n	a r iː v iː r t	arrivieren	arriviert	⋊ a r iː v iː r ə n ⋉	⋊ a r iː v iː r t ⋉
16541	22617	b ə f ɛː ɪ g ə n	b ə f ɛː ɪ ç t	befaehigen	befaehigt	⋊ b ə f ɛː ɪ g ə n ⋉	⋊ b ə f ɛː ɪ ç t ⋉
16547	22624	v ai̯ x ə n	g ə v ɪ x ə n	weichen	gewichen	⋊ v a i x ə n ⋉	⋊ v ɪ x ə n ⋉
16550	22628	n aː x ɛ r ts ɛː l ə n	n aː x ɛ r ts ɛː l t	nacherzaehlen	nacherzaehlt	⋊ n aː x ɛ r ts ɛː l ə n ⋉	⋊ n aː x ɛ r ts ɛː l t ⋉
16573	22657	t œ l p ə l n	g ə t œ l p ə l t	tölpeln	getölpelt	⋊ t œ l p ə l n ⋉	⋊ t œ l p ə l t ⋉
16596	22690	ai̯ n b ə r ɛ x n ə n	ai̯ n b ə r ɛ x n ə t	einberechnen	einberechnet	⋊ a i n b ə r ɛ x n ə n ⋉	⋊ a i n b ə r ɛ x n ə t ⋉
16604	22699	f uː z iː oː n iː r ə n	f uː z iː oː n iː r t	fusionieren	fusioniert	⋊ f uː z iː oː n iː r ə n ⋉	⋊ f uː z iː oː n iː r t ⋉
16606	22702	f ɛ s t z ɛ ts ə n	f ɛ s t g ə z ɛ ts t	festsetzen	festgesetzt	⋊ f ɛ s t z ɛ ts ə n ⋉	⋊ f ɛ s t g ə z ɛ ts t ⋉
16608	22705	b ə ai̯ n d r ʊ k ə n	b ə ai̯ n d r ʊ k t	beeindrucken	beeindruckt	⋊ b ə a i n d r ʊ k ə n ⋉	⋊ b ə a i n d r ʊ k t ⋉
16618	22719	f ɛ r d oi̯ t l ɪ x ə n	f ɛ r d oi̯ t l ɪ ç t	verdeutlichen	verdeutlicht	⋊ f ɛ r d o i t l ɪ x ə n ⋉	⋊ f ɛ r d o i t l ɪ ç t ⋉
16628	22736	h øː k ə r n	g ə h øː k ə r t	hökern	gehökert	⋊ h øː k ə r n ⋉	⋊ h øː k ə r t ⋉
16629	22737	h au̯ s h a l t ə n	h au̯ s g ə h a l t ə n	haushalten	hausgehalten	⋊ h a u s h a l t ə n ⋉	⋊ h a u s g ə h a l t ə n ⋉
16640	22749	k ɛ m ə n	g ə k ɛ m t	kämmen	gekämmt	⋊ k ɛ m ə n ⋉	⋊ k ɛ m t ⋉
16655	22774	b ə au̯ k a pf ə l n	b ə au̯ k a pf ə l t	beaugapfeln	beaugapfelt	⋊ b ə a u k a pf ə l n ⋉	⋊ b ə a u k a pf ə l t ⋉
16657	22776	m ʏ s ə n	g ə m ʊ s t	müssen	gemusst	⋊ m ʏ s ə n ⋉	⋊ m ʊ s t ⋉
16675	22805	k ɔ l iː d iː r ə n	k ɔ l iː d iː r t	kollidieren	kollidiert	⋊ k ɔ l iː d iː r ə n ⋉	⋊ k ɔ l iː d iː r t ⋉
16697	22838	ʊ m k l ai̯ d ə n	ʊ m g ə k l ai̯ d ə t	umkleiden	umgekleidet	⋊ ʊ m k l a i d ə n ⋉	⋊ ʊ m g ə k l a i d ə t ⋉
16706	22849	m ɛ r g ə l n	g ə m ɛ r g ə l t	mergeln	gemergelt	⋊ m ɛ r g ə l n ⋉	⋊ m ɛ r g ə l t ⋉
16728	22877	n ɪ b ə l n	g ə n ɪ b ə l t	nibbeln	genibbelt	⋊ n ɪ b ə l n ⋉	⋊ n ɪ b ə l t ⋉
16747	22903	a p k n œ pf ə n	a p g ə k n œ pf t	abknöpfen	abgeknöpft	⋊ a p k n œ pf ə n ⋉	⋊ a p g ə k n œ pf t ⋉
16748	22904	ɛ s k a l iː r ə n	ɛ s k a l iː r t	eskalieren	eskaliert	⋊ ɛ s k a l iː r ə n ⋉	⋊ ɛ s k a l iː r t ⋉
16779	22950	d ʊ r ç h ʊ ŋ ə r n	d ʊ r ç g ə h ʊ ŋ ə r t	durchhungern	durchgehungert	⋊ d ʊ r ç h ʊ ŋ ə r n ⋉	⋊ d ʊ r ç g ə h ʊ ŋ ə r t ⋉
16791	22965	k ɔ n t iː r ə n	k ɔ n t iː r t	kontieren	kontiert	⋊ k ɔ n t iː r ə n ⋉	⋊ k ɔ n t iː r t ⋉
16793	22972	ʊ m f ɪ r m iː r ə n	ʊ m f ɪ r m iː r t	umfirmieren	umfirmiert	⋊ ʊ m f ɪ r m iː r ə n ⋉	⋊ ʊ m f ɪ r m iː r t ⋉
16795	22976	b ə pf l a n ts ə n	b ə pf l a n ts t	bepflanzen	bepflanzt	⋊ b ə pf l a n ts ə n ⋉	⋊ b ə pf l a n ts t ⋉
16823	23012	a l eː g oː r iː z iː r ə n	a l eː g oː r iː z iː r t	allegorisieren	allegorisiert	⋊ a l eː g oː r iː z iː r ə n ⋉	⋊ a l eː g oː r iː z iː r t ⋉
16840	23034	p r oː n ɔ ŋ s iː r ə n	p r oː n ɔ ŋ s iː r t	prononcieren	prononciert	⋊ p r oː n ɔ ŋ s iː r ə n ⋉	⋊ p r oː n ɔ ŋ s iː r t ⋉
16894	23110	ɛ k s k ɔ m uː n iː ts iː r ə n	ɛ k s k ɔ m uː n iː ts iː r t	exkommunizieren	exkommuniziert	⋊ ɛ k s k ɔ m uː n iː ts iː r ə n ⋉	⋊ ɛ k s k ɔ m uː n iː ts iː r t ⋉
16899	23119	a n ʃ t eː ə n	a n g ə ʃ t a n d ə n	anstehen	angestanden	⋊ a n ʃ t eː ə n ⋉	⋊ a n g ə ʃ t a n d ə n ⋉
16948	23187	z a m ə l n	g ə z a m ə l t	sammeln	gesammelt	⋊ z a m ə l n ⋉	⋊ z a m ə l t ⋉
16949	23188	au̯ f h oː l ə n	au̯ f g ə h oː l t	aufholen	aufgeholt	⋊ a u f h oː l ə n ⋉	⋊ a u f g ə h oː l t ⋉
17018	23281	k au̯ d ə r v ɛ l ʃ ə n	g ə k au̯ d ə r v ɛ l ʃ t	kauderwelschen	gekauderwelscht	⋊ k a u d ə r v ɛ l ʃ ə n ⋉	⋊ k a u d ə r v ɛ l ʃ t ⋉
17023	23289	ts uː l a s ə n	ts uː g ə l a s ə n	zulassen	zugelassen	⋊ ts uː l a s ə n ⋉	⋊ ts uː g ə l a s ə n ⋉
17049	23328	a x t h aː b ə n	a x t g ə h aː p t	achthaben	achtgehabt	⋊ a x t h aː b ə n ⋉	⋊ a x t g ə h aː p t ⋉
17086	23378	l iː g ə n b l ai̯ b ə n	l iː g ə n g ə b l iː b ə n	liegenbleiben	liegengeblieben	⋊ l iː g ə n b l a i b ə n ⋉	⋊ l iː g ə n g ə b l iː b ə n ⋉
17095	23393	ʊ n t ə r n eː m ə n	ʊ n t ə r g ə n ɔ m ə n	unternehmen	untergenommen	⋊ ʊ n t ə r n eː m ə n ⋉	⋊ ʊ n t ə r g ə n ɔ m ə n ⋉
17180	23513	z ɪ x ə r n	g ə z ɪ x ə r t	sichern	gesichert	⋊ z ɪ x ə r n ⋉	⋊ z ɪ x ə r t ⋉
17254	23616	b ə g a t ə n	b ə g a t ə t	begatten	begattet	⋊ b ə g a t ə n ⋉	⋊ b ə g a t ə t ⋉
17255	23617	b ə a n ʃ t a n d ə n	b ə a n ʃ t a n d ə t	beanstanden	beanstandet	⋊ b ə a n ʃ t a n d ə n ⋉	⋊ b ə a n ʃ t a n d ə t ⋉
17269	23638	h ɪ n v ɛ k f eː g ə n	h ɪ n v ɛ k g ə f eː k t	hinwegfegen	hinweggefegt	⋊ h ɪ n v ɛ k f eː g ə n ⋉	⋊ h ɪ n v ɛ k g ə f eː k t ⋉
17276	23649	h a ʃ iː r ə n	h a ʃ iː r t	haschieren	haschiert	⋊ h a ʃ iː r ə n ⋉	⋊ h a ʃ iː r t ⋉
17283	23657	au̯ f ʃ r ai̯ ə n	au̯ f g ə ʃ r iː n	aufschreien	aufgeschrien	⋊ a u f ʃ r a i ə n ⋉	⋊ a u f g ə ʃ r iː n ⋉
17308	23697	ʊ m ʃ a f ə n	ʊ m g ə ʃ a f t	umschaffen	umgeschafft	⋊ ʊ m ʃ a f ə n ⋉	⋊ ʊ m g ə ʃ a f t ⋉
17313	23704	d ʊ r ç ʃ ai̯ n ə n	d ʊ r ç g ə ʃ iː n ə n	durchscheinen	durchgeschienen	⋊ d ʊ r ç ʃ a i n ə n ⋉	⋊ d ʊ r ç g ə ʃ iː n ə n ⋉
17314	23708	au̯ s z aː g ə n	au̯ s g ə z aː k t	aussagen	ausgesagt	⋊ a u s z aː g ə n ⋉	⋊ a u s g ə z aː k t ⋉
17317	23711	b ə f ai̯ n d ə n	b ə f ai̯ n d ə t	befeinden	befeindet	⋊ b ə f a i n d ə n ⋉	⋊ b ə f a i n d ə t ⋉
17376	23787	h ai̯ m h oː l ə n	h ai̯ m g ə h oː l t	heimholen	heimgeholt	⋊ h a i m h oː l ə n ⋉	⋊ h a i m g ə h oː l t ⋉
17418	23841	a p f ʏ t ə r n	a p g ə f ʏ t ə r t	abfüttern	abgefüttert	⋊ a p f ʏ t ə r n ⋉	⋊ a p g ə f ʏ t ə r t ⋉
17423	23848	ai̯ n h a l t ə n	ai̯ n g ə h a l t ə n	einhalten	eingehalten	⋊ a i n h a l t ə n ⋉	⋊ a i n g ə h a l t ə n ⋉
17425	23851	f ɛ r l oː z ə n	f ɛ r l oː s t	verlosen	verlost	⋊ f ɛ r l oː z ə n ⋉	⋊ f ɛ r l oː s t ⋉
17465	23910	n aː x v ai̯ z ə n	n aː x g ə v iː z ə n	nachweisen	nachgewiesen	⋊ n aː x v a i z ə n ⋉	⋊ n aː x g ə v iː z ə n ⋉
17493	23947	z iː x ə n	g ə z iː x t	siechen	gesiecht	⋊ z iː x ə n ⋉	⋊ z iː x t ⋉
17508	23969	ʃ t iː b ɪ ts ə n	ʃ t iː b ɪ ts t	stibitzen	stibitzt	⋊ ʃ t iː b ɪ ts ə n ⋉	⋊ ʃ t iː b ɪ ts t ⋉
17522	23989	h ɛ r ʊ n t ə r k ɔ m ə n	h ɛ r ʊ n t ə r g ə k ɔ m ə n	herunterkommen	heruntergekommen	⋊ h ɛ r ʊ n t ə r k ɔ m ə n ⋉	⋊ h ɛ r ʊ n t ə r g ə k ɔ m ə n ⋉
17622	24122	g ɪ f t ə n	g ə g ɪ f t ə t	giften	gegiftet	⋊ g ɪ f t ə n ⋉	⋊ g ɪ f t ə t ⋉
17666	24179	b ə ʃ p r yː ə n	b ə ʃ p r yː t	besprühen	besprüht	⋊ b ə ʃ p r yː ə n ⋉	⋊ b ə ʃ p r yː t ⋉
17682	24199	l ɛ p ə r n	g ə l ɛ p ə r t	läppern	geläppert	⋊ l ɛ p ə r n ⋉	⋊ l ɛ p ə r t ⋉
17756	24299	ɪ n h a f t iː r ə n	ɪ n h a f t iː r t	inhaftieren	inhaftiert	⋊ ɪ n h a f t iː r ə n ⋉	⋊ ɪ n h a f t iː r t ⋉
17797	24359	k ɛ l t ə r n	g ə k ɛ l t ə r t	keltern	gekeltert	⋊ k ɛ l t ə r n ⋉	⋊ k ɛ l t ə r t ⋉
17813	24382	f ɛ r v eː ə n	f ɛ r v eː t	verwehen	verweht	⋊ f ɛ r v eː ə n ⋉	⋊ f ɛ r v eː t ⋉
17824	24399	a p g l ai̯ x ə n	a p g ə g l ɪ x ə n	abgleichen	abgeglichen	⋊ a p g l a i x ə n ⋉	⋊ a p g ə g l ɪ x ə n ⋉
17874	24466	k v eː r uː l iː r ə n	k v eː r uː l iː r t	querulieren	queruliert	⋊ k v eː r uː l iː r ə n ⋉	⋊ k v eː r uː l iː r t ⋉
17892	24490	au̯ f ɛ r v ɛ k ə n	au̯ f ɛ r v ɛ k t	auferwecken	auferweckt	⋊ a u f ɛ r v ɛ k ə n ⋉	⋊ a u f ɛ r v ɛ k t ⋉
17926	24536	a p l ɛ ŋ k ə n	a p g ə l ɛ ŋ k t	ablenken	abgelenkt	⋊ a p l ɛ ŋ k ə n ⋉	⋊ a p g ə l ɛ ŋ k t ⋉
17947	24561	b ɔ r d iː r ə n	b ɔ r d iː r t	bordieren	bordiert	⋊ b ɔ r d iː r ə n ⋉	⋊ b ɔ r d iː r t ⋉
18000	24638	ʃ t ɛː l ə n	g ə ʃ t ɛː l t	staehlen	gestaehlt	⋊ ʃ t ɛː l ə n ⋉	⋊ ʃ t ɛː l t ⋉
18003	24643	ʃ l ai̯ m ə n	g ə ʃ l ai̯ m t	schleimen	geschleimt	⋊ ʃ l a i m ə n ⋉	⋊ ʃ l a i m t ⋉
18009	24649	ai̯ n b uː x t ə n	ai̯ n g ə b uː x t ə t	einbuchten	eingebuchtet	⋊ a i n b uː x t ə n ⋉	⋊ a i n g ə b uː x t ə t ⋉
18010	24650	v ɛ k k r iː g ə n	v ɛ k g ə k r iː k t	wegkriegen	weggekriegt	⋊ v ɛ k k r iː g ə n ⋉	⋊ v ɛ k g ə k r iː k t ⋉
18018	24658	a p ʃ a l t ə n	a p g ə ʃ a l t ə t	abschalten	abgeschaltet	⋊ a p ʃ a l t ə n ⋉	⋊ a p g ə ʃ a l t ə t ⋉
18068	24724	ʃ a l t ə n	g ə ʃ a l t ə t	schalten	geschaltet	⋊ ʃ a l t ə n ⋉	⋊ ʃ a l t ə t ⋉
18081	24742	b oi̯ g ə n	g ə b oi̯ k t	beugen	gebeugt	⋊ b o i g ə n ⋉	⋊ b o i k t ⋉
18130	24814	au̯ s l œ f ə l n	au̯ s g ə l œ f ə l t	auslöffeln	ausgelöffelt	⋊ a u s l œ f ə l n ⋉	⋊ a u s g ə l œ f ə l t ⋉
18133	24817	ai̯ n v a n d ə r n	ai̯ n g ə v a n d ə r t	einwandern	eingewandert	⋊ a i n v a n d ə r n ⋉	⋊ a i n g ə v a n d ə r t ⋉
18143	24830	ʃ t r iː g ə l n	g ə ʃ t r iː g ə l t	striegeln	gestriegelt	⋊ ʃ t r iː g ə l n ⋉	⋊ ʃ t r iː g ə l t ⋉
18149	24837	f ɛ r ʃ t au̯ b ə n	f ɛ r ʃ t au̯ p t	verstauben	verstaubt	⋊ f ɛ r ʃ t a u b ə n ⋉	⋊ f ɛ r ʃ t a u p t ⋉
18201	24903	ɛ r l yː g ə n	ɛ r l oː g ə n	erlügen	erlogen	⋊ ɛ r l yː g ə n ⋉	⋊ ɛ r l oː g ə n ⋉
18215	24931	ɛ r ʃ t ai̯ g ə r n	ɛ r ʃ t ai̯ g ə r t	ersteigern	ersteigert	⋊ ɛ r ʃ t a i g ə r n ⋉	⋊ ɛ r ʃ t a i g ə r t ⋉
18232	24958	au̯ s k ɔ f ə r n	au̯ s g ə k ɔ f ə r t	auskoffern	ausgekoffert	⋊ a u s k ɔ f ə r n ⋉	⋊ a u s g ə k ɔ f ə r t ⋉
18243	24974	ɛ r g r au̯ ə n	ɛ r g r au̯ t	ergrauen	ergraut	⋊ ɛ r g r a u ə n ⋉	⋊ ɛ r g r a u t ⋉
18261	25000	b l au̯ ə n	g ə b l au̯ t	blauen	geblaut	⋊ b l a u ə n ⋉	⋊ b l a u t ⋉
18290	25037	v eː b ə n	g ə v eː p t	weben	gewebt	⋊ v eː b ə n ⋉	⋊ v eː p t ⋉
18316	25070	ts ɛ r ʃ t r oi̯ ə n	ts ɛ r ʃ t r oi̯ t	zerstreuen	zerstreut	⋊ ts ɛ r ʃ t r o i ə n ⋉	⋊ ts ɛ r ʃ t r o i t ⋉
18337	25098	a p ʃ r ɛː g ə n	a p g ə ʃ r ɛː k t	abschrägen	abgeschrägt	⋊ a p ʃ r ɛː g ə n ⋉	⋊ a p g ə ʃ r ɛː k t ⋉
18343	25104	a s ɔ r t iː r ə n	a s ɔ r t iː r t	assortieren	assortiert	⋊ a s ɔ r t iː r ə n ⋉	⋊ a s ɔ r t iː r t ⋉
18352	25116	f ɛ r l œ ʃ ə n	f ɛ r l ɔ ʃ ə n	verlöschen	verloschen	⋊ f ɛ r l œ ʃ ə n ⋉	⋊ f ɛ r l ɔ ʃ ə n ⋉
18384	25158	ʃ ɛ ts ə n	g ə ʃ ɛ ts t	schätzen	geschätzt	⋊ ʃ ɛ ts ə n ⋉	⋊ ʃ ɛ ts t ⋉
18390	25165	h øː ə r ʃ r au̯ b ə n	h øː ə r g ə ʃ r au̯ p t	höherschrauben	höhergeschraubt	⋊ h øː ə r ʃ r a u b ə n ⋉	⋊ h øː ə r g ə ʃ r a u p t ⋉
18418	25200	r œ x ə l n	g ə r œ x ə l t	röcheln	geröchelt	⋊ r œ x ə l n ⋉	⋊ r œ x ə l t ⋉
18433	25219	a n t r ɛ n iː r ə n	a n t r ɛ n iː r t	antrainieren	antrainiert	⋊ a n t r ɛ n iː r ə n ⋉	⋊ a n t r ɛ n iː r t ⋉
18480	25285	n iː d ə r ʃ l aː g ə n	n iː d ə r g ə ʃ l aː g ə n	niederschlagen	niedergeschlagen	⋊ n iː d ə r ʃ l aː g ə n ⋉	⋊ n iː d ə r g ə ʃ l aː g ə n ⋉
18513	25333	k l ɛ m p ə r n	g ə k l ɛ m p ə r t	klempern	geklempert	⋊ k l ɛ m p ə r n ⋉	⋊ k l ɛ m p ə r t ⋉
18520	25343	ʊ n t ə r m ɪ ʃ ə n	ʊ n t ə r m ɪ ʃ t	untermischen	untermischt	⋊ ʊ n t ə r m ɪ ʃ ə n ⋉	⋊ ʊ n t ə r m ɪ ʃ t ⋉
18521	25348	f oː r ʃ v eː b ə n	f oː r g ə ʃ v eː p t	vorschweben	vorgeschwebt	⋊ f oː r ʃ v eː b ə n ⋉	⋊ f oː r g ə ʃ v eː p t ⋉
18533	25365	ɛ r a r b ai̯ t ə n	ɛ r a r b ai̯ t ə t	erarbeiten	erarbeitet	⋊ ɛ r a r b a i t ə n ⋉	⋊ ɛ r a r b a i t ə t ⋉
18611	25471	h oː f iː r ə n	h oː f iː r t	hofieren	hofiert	⋊ h oː f iː r ə n ⋉	⋊ h oː f iː r t ⋉
18620	25483	a n ʃ p yː l ə n	a n g ə ʃ p yː l t	anspülen	angespült	⋊ a n ʃ p yː l ə n ⋉	⋊ a n g ə ʃ p yː l t ⋉
18627	25491	ɛ n t ʃ p r ɪ ŋ ə n	ɛ n t ʃ p r ʊ ŋ ə n	entspringen	entsprungen	⋊ ɛ n t ʃ p r ɪ ŋ ə n ⋉	⋊ ɛ n t ʃ p r ʊ ŋ ə n ⋉
18735	25638	r ai̯ n v a ʃ ə n	r ai̯ n g ə v a ʃ ə n	reinwaschen	reingewaschen	⋊ r a i n v a ʃ ə n ⋉	⋊ r a i n g ə v a ʃ ə n ⋉
18743	25648	r eː t a r d iː r ə n	r eː t a r d iː r t	retardieren	retardiert	⋊ r eː t a r d iː r ə n ⋉	⋊ r eː t a r d iː r t ⋉
18750	25660	ʊ m k ɛ m pf ə n	ʊ m k ɛ m pf t	umkämpfen	umkämpft	⋊ ʊ m k ɛ m pf ə n ⋉	⋊ ʊ m k ɛ m pf t ⋉
18767	25684	ai̯ n b l ɪ k ə n	ai̯ n g ə b l ɪ k t	einblicken	eingeblickt	⋊ a i n b l ɪ k ə n ⋉	⋊ a i n g ə b l ɪ k t ⋉
18771	25688	l oː n ə n	g ə l oː n t	lohnen	gelohnt	⋊ l oː n ə n ⋉	⋊ l oː n t ⋉
18773	25691	b ə f oi̯ ə r n	b ə f oi̯ ə r t	befeuern	befeuert	⋊ b ə f o i ə r n ⋉	⋊ b ə f o i ə r t ⋉
18780	25700	k n ʏ p ə l n	g ə k n ʏ p ə l t	knüppeln	geknüppelt	⋊ k n ʏ p ə l n ⋉	⋊ k n ʏ p ə l t ⋉
18855	25811	ʊ m z iː d ə l n	ʊ m g ə z iː d ə l t	umsiedeln	umgesiedelt	⋊ ʊ m z iː d ə l n ⋉	⋊ ʊ m g ə z iː d ə l t ⋉
18868	25827	au̯ f l ɔ k ə r n	au̯ f g ə l ɔ k ə r t	auflockern	aufgelockert	⋊ a u f l ɔ k ə r n ⋉	⋊ a u f g ə l ɔ k ə r t ⋉
18888	25857	au̯ s b l uː t ə n	au̯ s g ə b l uː t ə t	ausbluten	ausgeblutet	⋊ a u s b l uː t ə n ⋉	⋊ a u s g ə b l uː t ə t ⋉
18894	25863	f ɛ r l eː g ə n	f ɛ r l eː k t	verlegen	verlegt	⋊ f ɛ r l eː g ə n ⋉	⋊ f ɛ r l eː k t ⋉
18904	25879	ʃ p eː k uː l iː r ə n	ʃ p eː k uː l iː r t	spekulieren	spekuliert	⋊ ʃ p eː k uː l iː r ə n ⋉	⋊ ʃ p eː k uː l iː r t ⋉
18936	25921	ʊ m r a ŋ k ə n	ʊ m r a ŋ k t	umranken	umrankt	⋊ ʊ m r a ŋ k ə n ⋉	⋊ ʊ m r a ŋ k t ⋉
18942	25929	v œ l b ə n	g ə v œ l p t	wölben	gewölbt	⋊ v œ l b ə n ⋉	⋊ v œ l p t ⋉
18980	25979	l yː g ə n	g ə l oː g ə n	lügen	gelogen	⋊ l yː g ə n ⋉	⋊ l oː g ə n ⋉
19009	26020	ɛ r r ai̯ x ə n	ɛ r r ai̯ x t	erreichen	erreicht	⋊ ɛ r r a i x ə n ⋉	⋊ ɛ r r a i x t ⋉
19019	26035	l oː s g eː ə n	l oː s g ə g a ŋ ə n	losgehen	losgegangen	⋊ l oː s g eː ə n ⋉	⋊ l oː s g ə g a ŋ ə n ⋉
19043	26062	ai̯ n g ə ʃ t eː ə n	ai̯ n g ə ʃ t a n d ə n	eingestehen	eingestanden	⋊ a i n g ə ʃ t eː ə n ⋉	⋊ a i n g ə ʃ t a n d ə n ⋉
19119	26173	yː b ə r ai̯ n k ɔ m ə n	yː b ə r ai̯ n g ə k ɔ m ə n	übereinkommen	übereingekommen	⋊ yː b ə r a i n k ɔ m ə n ⋉	⋊ yː b ə r a i n g ə k ɔ m ə n ⋉
19132	26192	f ɛ r k ɛ n ə n	f ɛ r k a n t	verkennen	verkannt	⋊ f ɛ r k ɛ n ə n ⋉	⋊ f ɛ r k a n t ⋉
19144	26212	f ɛ r z eː r ə n	f ɛ r z eː r t	versehren	versehrt	⋊ f ɛ r z eː r ə n ⋉	⋊ f ɛ r z eː r t ⋉
19146	26214	ʊ m p oː l ə n	ʊ m g ə p oː l t	umpolen	umgepolt	⋊ ʊ m p oː l ə n ⋉	⋊ ʊ m g ə p oː l t ⋉
19160	26239	m ɪ t ʃ p iː l ə n	m ɪ t g ə ʃ p iː l t	mitspielen	mitgespielt	⋊ m ɪ t ʃ p iː l ə n ⋉	⋊ m ɪ t g ə ʃ p iː l t ⋉
19168	26248	h oː x l eː g ə n	h oː x g ə l eː k t	hochlegen	hochgelegt	⋊ h oː x l eː g ə n ⋉	⋊ h oː x g ə l eː k t ⋉
19224	26325	ʃ t ɔ k ə n	g ə ʃ t ɔ k t	stocken	gestockt	⋊ ʃ t ɔ k ə n ⋉	⋊ ʃ t ɔ k t ⋉
19228	26331	l oː ʒ iː r ə n	l oː ʒ iː r t	logieren	logiert	⋊ l oː ʒ iː r ə n ⋉	⋊ l oː ʒ iː r t ⋉
19231	26334	a p pf l ʏ k ə n	a p g ə pf l ʏ k t	abpflücken	abgepflückt	⋊ a p pf l ʏ k ə n ⋉	⋊ a p g ə pf l ʏ k t ⋉
19268	26386	g r ɛː m ə n	g ə g r ɛː m t	grämen	gegrämt	⋊ g r ɛː m ə n ⋉	⋊ g r ɛː m t ⋉
19269	26387	ai̯ n ʃ p r ɛ x ə n	ai̯ n g ə ʃ p r ɔ x ə n	einsprechen	eingesprochen	⋊ a i n ʃ p r ɛ x ə n ⋉	⋊ a i n g ə ʃ p r ɔ x ə n ⋉
19275	26394	r ɛ x ə n	g ə r ɛ x t	rechen	gerecht	⋊ r ɛ x ə n ⋉	⋊ r ɛ x t ⋉
19345	26491	ʃ l ʊ s f ɔ l g ə r n	g ə ʃ l ʊ s f ɔ l g ə r t	schlussfolgern	geschlussfolgert	⋊ ʃ l ʊ s f ɔ l g ə r n ⋉	⋊ ʃ l ʊ s f ɔ l g ə r t ⋉
19346	26493	oː n a n iː r ə n	oː n a n iː r t	onanieren	onaniert	⋊ oː n a n iː r ə n ⋉	⋊ oː n a n iː r t ⋉
19378	26539	b ə t ai̯ l ɪ g ə n	b ə t ai̯ l ɪ ç t	beteiligen	beteiligt	⋊ b ə t a i l ɪ g ə n ⋉	⋊ b ə t a i l ɪ ç t ⋉
19384	26547	au̯ s ts aː l ə n	au̯ s g ə ts aː l t	auszahlen	ausgezahlt	⋊ a u s ts aː l ə n ⋉	⋊ a u s g ə ts aː l t ⋉
19436	26617	h iː n ai̯ n g ə r aː t ə n	h iː n ai̯ n g ə r aː t ə n	hineingeraten	hineingeraten	⋊ h iː n a i n g ə r aː t ə n ⋉	⋊ h iː n a i n g ə r aː t ə n ⋉
19473	26664	ai̯ n ʃ r ʊ m pf ə n	ai̯ n g ə ʃ r ʊ m pf t	einschrumpfen	eingeschrumpft	⋊ a i n ʃ r ʊ m pf ə n ⋉	⋊ a i n g ə ʃ r ʊ m pf t ⋉
19488	26688	v ai̯ z ə n	g ə v iː z ə n	weisen	gewiesen	⋊ v a i z ə n ⋉	⋊ v iː z ə n ⋉
19492	26694	a n g eː b ə n	a n g ə g eː b ə n	angeben	angegeben	⋊ a n g eː b ə n ⋉	⋊ a n g ə g eː b ə n ⋉
19502	26711	ɛ n t g eː g ə n l au̯ f ə n	ɛ n t g eː g ə n g ə l au̯ f ə n	entgegenlaufen	entgegengelaufen	⋊ ɛ n t g eː g ə n l a u f ə n ⋉	⋊ ɛ n t g eː g ə n g ə l a u f ə n ⋉
19505	26714	d r ʊ k ə n	g ə d r ʊ k t	drucken	gedruckt	⋊ d r ʊ k ə n ⋉	⋊ d r ʊ k t ⋉
19532	26752	m a r m oː r iː r ə n	m a r m oː r iː r t	marmorieren	marmoriert	⋊ m a r m oː r iː r ə n ⋉	⋊ m a r m oː r iː r t ⋉
19540	26763	a x t g eː b ə n	a x t g ə g eː b ə n	achtgeben	achtgegeben	⋊ a x t g eː b ə n ⋉	⋊ a x t g ə g eː b ə n ⋉
19543	26766	d eː k oː d iː r ə n	d eː k oː d iː r t	dekodieren	dekodiert	⋊ d eː k oː d iː r ə n ⋉	⋊ d eː k oː d iː r t ⋉
19551	26778	f oː r ʃ l aː g ə n	f oː r g ə ʃ l aː g ə n	vorschlagen	vorgeschlagen	⋊ f oː r ʃ l aː g ə n ⋉	⋊ f oː r g ə ʃ l aː g ə n ⋉
19581	26820	ts ɛ r m a r t ə r n	ts ɛ r m a r t ə r t	zermartern	zermartert	⋊ ts ɛ r m a r t ə r n ⋉	⋊ ts ɛ r m a r t ə r t ⋉
19587	26827	d ʊ r ç l ɔ x ə n	d ʊ r ç l ɔ x t	durchlochen	durchlocht	⋊ d ʊ r ç l ɔ x ə n ⋉	⋊ d ʊ r ç l ɔ x t ⋉
19610	26859	v a x h a l t ə n	v a x g ə h a l t ə n	wachhalten	wachgehalten	⋊ v a x h a l t ə n ⋉	⋊ v a x g ə h a l t ə n ⋉
19624	26877	ai̯ n l ɛ r n ə n	ai̯ n g ə l ɛ r n t	einlernen	eingelernt	⋊ a i n l ɛ r n ə n ⋉	⋊ a i n g ə l ɛ r n t ⋉
19671	26948	f r a k ts iː oː n iː r ə n	f r a k ts iː oː n iː r t	fraktionieren	fraktioniert	⋊ f r a k ts iː oː n iː r ə n ⋉	⋊ f r a k ts iː oː n iː r t ⋉
19728	27028	ai̯ n ʃ p ai̯ z ə n	ai̯ n g ə ʃ p ai̯ s t	einspeisen	eingespeist	⋊ a i n ʃ p a i z ə n ⋉	⋊ a i n g ə ʃ p a i s t ⋉
19733	27034	au̯ f ʃ n a p ə n	au̯ f g ə ʃ n a p t	aufschnappen	aufgeschnappt	⋊ a u f ʃ n a p ə n ⋉	⋊ a u f g ə ʃ n a p t ⋉
19734	27037	r eː p a r iː r ə n	r eː p a r iː r t	reparieren	repariert	⋊ r eː p a r iː r ə n ⋉	⋊ r eː p a r iː r t ⋉
19756	27068	a l k yː l iː r ə n	a l k yː l iː r t	alkylieren	alkyliert	⋊ a l k yː l iː r ə n ⋉	⋊ a l k yː l iː r t ⋉
19765	27078	b ə n ai̯ d ə n	b ə n ai̯ d ə t	beneiden	beneidet	⋊ b ə n a i d ə n ⋉	⋊ b ə n a i d ə t ⋉
19793	27120	f ɛ r a p ʃ iː d ə n	f ɛ r a p ʃ iː d ə t	verabschieden	verabschiedet	⋊ f ɛ r a p ʃ iː d ə n ⋉	⋊ f ɛ r a p ʃ iː d ə t ⋉
19834	27172	a n t ai̯ g ə n	a n g ə t ai̯ k t	anteigen	angeteigt	⋊ a n t a i g ə n ⋉	⋊ a n g ə t a i k t ⋉
19840	27178	au̯ s ʃ l aː f ə n	au̯ s g ə ʃ l aː f ə n	ausschlafen	ausgeschlafen	⋊ a u s ʃ l aː f ə n ⋉	⋊ a u s g ə ʃ l aː f ə n ⋉
19844	27184	r iː f ə n	g ə r iː f t	riefen	gerieft	⋊ r iː f ə n ⋉	⋊ r iː f t ⋉
19855	27197	m ɛ ŋ ə n	g ə m ɛ ŋ t	mengen	gemengt	⋊ m ɛ ŋ ə n ⋉	⋊ m ɛ ŋ t ⋉
19889	27243	l iː m iː t iː r ə n	l iː m iː t iː r t	limitieren	limitiert	⋊ l iː m iː t iː r ə n ⋉	⋊ l iː m iː t iː r t ⋉
19891	27245	f ɛː d ə l n	g ə f ɛː d ə l t	fädeln	gefädelt	⋊ f ɛː d ə l n ⋉	⋊ f ɛː d ə l t ⋉
19909	27272	au̯ s ʃ ɔ p ə n	au̯ s g ə ʃ ɔ p t	ausschoppen	ausgeschoppt	⋊ a u s ʃ ɔ p ə n ⋉	⋊ a u s g ə ʃ ɔ p t ⋉
19916	27283	ɛ n t k l ai̯ d ə n	ɛ n t k l ai̯ d ə t	entkleiden	entkleidet	⋊ ɛ n t k l a i d ə n ⋉	⋊ ɛ n t k l a i d ə t ⋉
19931	27303	ai̯ n t r ɛ f ə n	ai̯ n g ə t r ɔ f ə n	eintreffen	eingetroffen	⋊ a i n t r ɛ f ə n ⋉	⋊ a i n g ə t r ɔ f ə n ⋉
19977	27365	ts uː f oː r t uː n	ts uː f oː r g ə t aː n	zuvortun	zuvorgetan	⋊ ts uː f oː r t uː n ⋉	⋊ ts uː f oː r g ə t aː n ⋉
19992	27383	yː b ə r d ɛ ŋ k ə n	yː b ə r d a x t	überdenken	überdacht	⋊ yː b ə r d ɛ ŋ k ə n ⋉	⋊ yː b ə r d a x t ⋉
20006	27400	ɛ n t r ɪ n ə n	ɛ n t r ɔ n ə n	entrinnen	entronnen	⋊ ɛ n t r ɪ n ə n ⋉	⋊ ɛ n t r ɔ n ə n ⋉
20012	27407	ɛ r ʃ ɪ m ə r n	ɛ r ʃ ɪ m ə r t	erschimmern	erschimmert	⋊ ɛ r ʃ ɪ m ə r n ⋉	⋊ ɛ r ʃ ɪ m ə r t ⋉
20067	27483	f r eː k v ɛ n t iː r ə n	f r eː k v ɛ n t iː r t	frequentieren	frequentiert	⋊ f r eː k v ɛ n t iː r ə n ⋉	⋊ f r eː k v ɛ n t iː r t ⋉
20153	27604	b aː d ə n	g ə b aː d ə t	baden	gebadet	⋊ b aː d ə n ⋉	⋊ b aː d ə t ⋉
20182	27644	d ʊ r ç v aː t ə n	d ʊ r ç v aː t ə t	durchwaten	durchwatet	⋊ d ʊ r ç v aː t ə n ⋉	⋊ d ʊ r ç v aː t ə t ⋉
20214	27686	d ʊ r ç ʃ t oː s ə n	d ʊ r ç g ə ʃ t oː s ə n	durchstossen	durchgestossen	⋊ d ʊ r ç ʃ t oː s ə n ⋉	⋊ d ʊ r ç g ə ʃ t oː s ə n ⋉
20224	27700	t a l k uː m iː r ə n	t a l k uː m iː r t	talkumieren	talkumiert	⋊ t a l k uː m iː r ə n ⋉	⋊ t a l k uː m iː r t ⋉
20226	27702	ts ɛ r f ɛ ts ə n	ts ɛ r f ɛ ts t	zerfetzen	zerfetzt	⋊ ts ɛ r f ɛ ts ə n ⋉	⋊ ts ɛ r f ɛ ts t ⋉
