level_0	index	wordform1	wordform2	wordform1_orth	wordform2_orth	stem	output
29	42	v ai̯ t ə r f ɛ r m iː t ə n	v ai̯ t ə r f ɛ r m iː t ə t	weitervermieten	weitervermietet	⋊ v a i t ə r f ɛ r m iː t ə n ⋉	⋊ v a i t ə r f ɛ r m iː t ə t ⋉
36	53	d r ai̯ n m ɪ ʃ ə n	d r ai̯ n g ə m ɪ ʃ t	dreinmischen	dreingemischt	⋊ d r a i n m ɪ ʃ ə n ⋉	⋊ d r a i n g ə m ɪ ʃ t ⋉
38	55	yː b ə r ʃ ʊ l d ə n	yː b ə r ʃ ʊ l d ə t	überschulden	überschuldet	⋊ yː b ə r ʃ ʊ l d ə n ⋉	⋊ yː b ə r ʃ ʊ l d ə t ⋉
41	63	au̯ f ʃ r ɛ k ə n	au̯ f g ə ʃ r ɔ k ə n	aufschrecken	aufgeschrocken	⋊ a u f ʃ r ɛ k ə n ⋉	⋊ a u f g ə ʃ r ɔ k ə n ⋉
56	82	ai̯ n b ə ʃ t ɛ l ə n	ai̯ n b ə ʃ t ɛ l t	einbestellen	einbestellt	⋊ a i n b ə ʃ t ɛ l ə n ⋉	⋊ a i n b ə ʃ t ɛ l t ⋉
62	89	ʊ m b ɪ n d ə n	ʊ m g ə b ʊ n d ə n	umbinden	umgebunden	⋊ ʊ m b ɪ n d ə n ⋉	⋊ ʊ m g ə b ʊ n d ə n ⋉
75	105	f ɔ r ʃ ə n	g ə f ɔ r ʃ t	forschen	geforscht	⋊ f ɔ r ʃ ə n ⋉	⋊ f ɔ r ʃ t ⋉
83	114	h ɪ n ʃ l aː g ə n	h ɪ n g ə ʃ l aː g ə n	hinschlagen	hingeschlagen	⋊ h ɪ n ʃ l aː g ə n ⋉	⋊ h ɪ n g ə ʃ l aː g ə n ⋉
88	119	a n ʃ iː b ə n	a n g ə ʃ oː b ə n	anschieben	angeschoben	⋊ a n ʃ iː b ə n ⋉	⋊ a n g ə ʃ oː b ə n ⋉
203	273	b ə k ʊ n d ə n	b ə k ʊ n d ə t	bekunden	bekundet	⋊ b ə k ʊ n d ə n ⋉	⋊ b ə k ʊ n d ə t ⋉
210	280	ʃ ɪ m ə r n	g ə ʃ ɪ m ə r t	schimmern	geschimmert	⋊ ʃ ɪ m ə r n ⋉	⋊ ʃ ɪ m ə r t ⋉
214	284	a p t ai̯ l ə n	a p g ə t ai̯ l t	abteilen	abgeteilt	⋊ a p t a i l ə n ⋉	⋊ a p g ə t a i l t ⋉
218	291	l ɛ k ʃ l aː g ə n	l ɛ k g ə ʃ l aː g ə n	leckschlagen	leckgeschlagen	⋊ l ɛ k ʃ l aː g ə n ⋉	⋊ l ɛ k g ə ʃ l aː g ə n ⋉
220	293	b r ɛ m z ə n	g ə b r ɛ m s t	bremsen	gebremst	⋊ b r ɛ m z ə n ⋉	⋊ b r ɛ m s t ⋉
223	297	ɛ n t g eː g ə n ʃ t eː ə n	ɛ n t g eː g ə n g ə ʃ t a n d ə n	entgegenstehen	entgegengestanden	⋊ ɛ n t g eː g ə n ʃ t eː ə n ⋉	⋊ ɛ n t g eː g ə n g ə ʃ t a n d ə n ⋉
227	305	ʃ t r a n d ə n	g ə ʃ t r a n d ə t	stranden	gestrandet	⋊ ʃ t r a n d ə n ⋉	⋊ ʃ t r a n d ə t ⋉
264	349	k ɔ p ə l n	g ə k ɔ p ə l t	koppeln	gekoppelt	⋊ k ɔ p ə l n ⋉	⋊ k ɔ p ə l t ⋉
284	377	r a s ə l n	g ə r a s ə l t	rasseln	gerasselt	⋊ r a s ə l n ⋉	⋊ r a s ə l t ⋉
310	415	ɛ r ts oi̯ g ə n	ɛ r ts oi̯ k t	erzeugen	erzeugt	⋊ ɛ r ts o i g ə n ⋉	⋊ ɛ r ts o i k t ⋉
323	432	r ai̯ n ə n	g ə r ai̯ n t	rainen	geraint	⋊ r a i n ə n ⋉	⋊ r a i n t ⋉
326	436	ʊ m r ai̯ s ə n	ʊ m r ɪ s ə n	umreissen	umrissen	⋊ ʊ m r a i s ə n ⋉	⋊ ʊ m r ɪ s ə n ⋉
330	441	p r ɛ z uː m iː r ə n	p r ɛ z uː m iː r t	präsumieren	präsumiert	⋊ p r ɛ z uː m iː r ə n ⋉	⋊ p r ɛ z uː m iː r t ⋉
339	453	b l ɪ n t ʃ p iː l ə n	b l ɪ n t g ə ʃ p iː l t	blindspielen	blindgespielt	⋊ b l ɪ n t ʃ p iː l ə n ⋉	⋊ b l ɪ n t g ə ʃ p iː l t ⋉
410	552	ɛ r aː n ə n	ɛ r aː n t	erahnen	erahnt	⋊ ɛ r aː n ə n ⋉	⋊ ɛ r aː n t ⋉
412	554	ʊ m h au̯ ə n	ʊ m g ə h au̯ n	umhauen	umgehaun	⋊ ʊ m h a u ə n ⋉	⋊ ʊ m g ə h a u n ⋉
417	561	ai̯ n t yː t ə n	ai̯ n g ə t yː t ə t	eintüten	eingetütet	⋊ a i n t yː t ə n ⋉	⋊ a i n g ə t yː t ə t ⋉
419	567	ai̯ n k ɛ r k ə r n	ai̯ n g ə k ɛ r k ə r t	einkerkern	eingekerkert	⋊ a i n k ɛ r k ə r n ⋉	⋊ a i n g ə k ɛ r k ə r t ⋉
464	633	ʊ m ts ai̯ x n ə n	ʊ m g ə ts ai̯ x n ə t	umzeichnen	umgezeichnet	⋊ ʊ m ts a i x n ə n ⋉	⋊ ʊ m g ə ts a i x n ə t ⋉
487	656	f ɛ r m iː z ə n	f ɛ r m iː s t	vermiesen	vermiest	⋊ f ɛ r m iː z ə n ⋉	⋊ f ɛ r m iː s t ⋉
506	685	ɛ n t l au̯ b ə n	ɛ n t l au̯ p t	entlauben	entlaubt	⋊ ɛ n t l a u b ə n ⋉	⋊ ɛ n t l a u p t ⋉
555	754	f ɛ r a l t ə n	f ɛ r a l t ə t	veralten	veraltet	⋊ f ɛ r a l t ə n ⋉	⋊ f ɛ r a l t ə t ⋉
572	778	f ɛ r k ɔ n z uː m iː r ə n	f ɛ r k ɔ n z uː m iː r t	verkonsumieren	verkonsumiert	⋊ f ɛ r k ɔ n z uː m iː r ə n ⋉	⋊ f ɛ r k ɔ n z uː m iː r t ⋉
581	788	a p z uː x ə n	a p g ə z uː x t	absuchen	abgesucht	⋊ a p z uː x ə n ⋉	⋊ a p g ə z uː x t ⋉
591	804	a n t a l j iː r ə n	a n t a l j iː r t	antaillieren	antailliert	⋊ a n t a l j iː r ə n ⋉	⋊ a n t a l j iː r t ⋉
594	807	ɛ r k l ɪ ŋ ə n	ɛ r k l ʊ ŋ ə n	erklingen	erklungen	⋊ ɛ r k l ɪ ŋ ə n ⋉	⋊ ɛ r k l ʊ ŋ ə n ⋉
601	814	p r oː b iː r ə n	p r oː b iː r t	probieren	probiert	⋊ p r oː b iː r ə n ⋉	⋊ p r oː b iː r t ⋉
603	817	au̯ s h ɛ r t ə n	au̯ s g ə h ɛ r t ə t	aushärten	ausgehärtet	⋊ a u s h ɛ r t ə n ⋉	⋊ a u s g ə h ɛ r t ə t ⋉
606	820	m ɛ ts ə l n	g ə m ɛ ts ə l t	metzeln	gemetzelt	⋊ m ɛ ts ə l n ⋉	⋊ m ɛ ts ə l t ⋉
610	824	t r eː m uː l iː r ə n	t r eː m uː l iː r t	tremulieren	tremuliert	⋊ t r eː m uː l iː r ə n ⋉	⋊ t r eː m uː l iː r t ⋉
619	834	f ɛ s t h ɛ f t ə n	f ɛ s t g ə h ɛ f t ə t	festheften	festgeheftet	⋊ f ɛ s t h ɛ f t ə n ⋉	⋊ f ɛ s t g ə h ɛ f t ə t ⋉
627	849	ts ɛ r m a l m ə n	ts ɛ r m a l m t	zermalmen	zermalmt	⋊ ts ɛ r m a l m ə n ⋉	⋊ ts ɛ r m a l m t ⋉
654	892	ʊ ŋ k ə n	g ə ʊ ŋ k t	unken	geunkt	⋊ ʊ ŋ k ə n ⋉	⋊ ʊ ŋ k t ⋉
664	904	a p l ai̯ ə r n	a p g ə l ai̯ ə r t	ableiern	abgeleiert	⋊ a p l a i ə r n ⋉	⋊ a p g ə l a i ə r t ⋉
670	913	k l a k ə n	g ə k l a k t	klacken	geklackt	⋊ k l a k ə n ⋉	⋊ k l a k t ⋉
759	1045	au̯ f ʃ oi̯ x ə n	au̯ f g ə ʃ oi̯ x t	aufscheuchen	aufgescheucht	⋊ a u f ʃ o i x ə n ⋉	⋊ a u f g ə ʃ o i x t ⋉
772	1067	k a t eː g oː r iː z iː r ə n	k a t eː g oː r iː z iː r t	kategorisieren	kategorisiert	⋊ k a t eː g oː r iː z iː r ə n ⋉	⋊ k a t eː g oː r iː z iː r t ⋉
776	1071	h iː n ai̯ n r ɛ n ə n	h iː n ai̯ n g ə r a n t	hineinrennen	hineingerannt	⋊ h iː n a i n r ɛ n ə n ⋉	⋊ h iː n a i n g ə r a n t ⋉
820	1131	l a k iː r ə n	l a k iː r t	lackieren	lackiert	⋊ l a k iː r ə n ⋉	⋊ l a k iː r t ⋉
837	1154	f ɛ r ʃ l iː s ə n	f ɛ r ʃ l ɔ s ə n	verschliessen	verschlossen	⋊ f ɛ r ʃ l iː s ə n ⋉	⋊ f ɛ r ʃ l ɔ s ə n ⋉
841	1159	b ə h au̯ ə n	b ə h au̯ n	behauen	behaun	⋊ b ə h a u ə n ⋉	⋊ b ə h a u n ⋉
842	1160	yː b ə r ai̯ l ə n	yː b ə r ai̯ l t	übereilen	übereilt	⋊ yː b ə r a i l ə n ⋉	⋊ yː b ə r a i l t ⋉
885	1219	au̯ s k r aː g ə n	au̯ s g ə k r aː k t	auskragen	ausgekragt	⋊ a u s k r aː g ə n ⋉	⋊ a u s g ə k r aː k t ⋉
893	1229	f ɛ r ʃ t r oi̯ ə n	f ɛ r ʃ t r oi̯ t	verstreuen	verstreut	⋊ f ɛ r ʃ t r o i ə n ⋉	⋊ f ɛ r ʃ t r o i t ⋉
920	1269	a n k r ai̯ d ə n	a n g ə k r ai̯ d ə t	ankreiden	angekreidet	⋊ a n k r a i d ə n ⋉	⋊ a n g ə k r a i d ə t ⋉
942	1297	h oː x h a l t ə n	h oː x g ə h a l t ə n	hochhalten	hochgehalten	⋊ h oː x h a l t ə n ⋉	⋊ h oː x g ə h a l t ə n ⋉
965	1330	f r ai̯ m a x ə n	f r ai̯ g ə m a x t	freimachen	freigemacht	⋊ f r a i m a x ə n ⋉	⋊ f r a i g ə m a x t ⋉
1003	1384	yː b ə r g eː ə n	yː b ə r g a ŋ ə n	übergehen	übergangen	⋊ yː b ə r g eː ə n ⋉	⋊ yː b ə r g a ŋ ə n ⋉
1015	1398	ts uː r ʏ k l eː n ə n	ts uː r ʏ k g ə l eː n t	zurücklehnen	zurückgelehnt	⋊ ts uː r ʏ k l eː n ə n ⋉	⋊ ts uː r ʏ k g ə l eː n t ⋉
1029	1422	au̯ f b a k ə n	au̯ f g ə b a k ə n	aufbacken	aufgebacken	⋊ a u f b a k ə n ⋉	⋊ a u f g ə b a k ə n ⋉
1047	1453	b l yː ə n	g ə b l yː t	blühen	geblüht	⋊ b l yː ə n ⋉	⋊ b l yː t ⋉
1073	1482	ai̯ n ʃ p a n ə n	ai̯ n g ə ʃ p a n t	einspannen	eingespannt	⋊ a i n ʃ p a n ə n ⋉	⋊ a i n g ə ʃ p a n t ⋉
1081	1494	a n ʃ r ai̯ ə n	a n g ə ʃ r iː n	anschreien	angeschrien	⋊ a n ʃ r a i ə n ⋉	⋊ a n g ə ʃ r iː n ⋉
1084	1498	au̯ s v ɛː g ə n	au̯ s g ə v ɛː k t	auswägen	ausgewägt	⋊ a u s v ɛː g ə n ⋉	⋊ a u s g ə v ɛː k t ⋉
1109	1534	r ʊ n t ə r ʃ l ʊ k ə n	r ʊ n t ə r g ə ʃ l ʊ k t	runterschlucken	runtergeschluckt	⋊ r ʊ n t ə r ʃ l ʊ k ə n ⋉	⋊ r ʊ n t ə r g ə ʃ l ʊ k t ⋉
1119	1547	l eː g iː r ə n	l eː g iː r t	legieren	legiert	⋊ l eː g iː r ə n ⋉	⋊ l eː g iː r t ⋉
1122	1550	z ɪ g n iː r ə n	z ɪ g n iː r t	signieren	signiert	⋊ z ɪ g n iː r ə n ⋉	⋊ z ɪ g n iː r t ⋉
1140	1575	p a r d oː n iː r ə n	p a r d oː n iː r t	pardonieren	pardoniert	⋊ p a r d oː n iː r ə n ⋉	⋊ p a r d oː n iː r t ⋉
1156	1597	h ɛ r ʊ n t ə r ʃ p iː l ə n	h ɛ r ʊ n t ə r g ə ʃ p iː l t	herunterspielen	heruntergespielt	⋊ h ɛ r ʊ n t ə r ʃ p iː l ə n ⋉	⋊ h ɛ r ʊ n t ə r g ə ʃ p iː l t ⋉
1157	1598	f ɛ s ə l n	g ə f ɛ s ə l t	fesseln	gefesselt	⋊ f ɛ s ə l n ⋉	⋊ f ɛ s ə l t ⋉
1166	1611	f ɛ r v ai̯ z ə n	f ɛ r v iː z ə n	verweisen	verwiesen	⋊ f ɛ r v a i z ə n ⋉	⋊ f ɛ r v iː z ə n ⋉
1176	1622	m ɪ s g l ʏ k ə n	m ɪ s g l ʏ k t	missglücken	missglückt	⋊ m ɪ s g l ʏ k ə n ⋉	⋊ m ɪ s g l ʏ k t ⋉
1185	1641	b ʏ ʃ ə l n	g ə b ʏ ʃ ə l t	büscheln	gebüschelt	⋊ b ʏ ʃ ə l n ⋉	⋊ b ʏ ʃ ə l t ⋉
1210	1672	f ɛ r v ɪ k ə l n	f ɛ r v ɪ k ə l t	verwickeln	verwickelt	⋊ f ɛ r v ɪ k ə l n ⋉	⋊ f ɛ r v ɪ k ə l t ⋉
1234	1707	d aː h ɪ n ʃ t eː ə n	d aː h ɪ n g ə ʃ t a n d ə n	dahinstehen	dahingestanden	⋊ d aː h ɪ n ʃ t eː ə n ⋉	⋊ d aː h ɪ n g ə ʃ t a n d ə n ⋉
1249	1726	f ɪ ʃ ə n	g ə f ɪ ʃ t	fischen	gefischt	⋊ f ɪ ʃ ə n ⋉	⋊ f ɪ ʃ t ⋉
1284	1769	l iː f ə r n	g ə l iː f ə r t	liefern	geliefert	⋊ l iː f ə r n ⋉	⋊ l iː f ə r t ⋉
1341	1853	h ɛ r a n t a s t ə n	h ɛ r a n g ə t a s t ə t	herantasten	herangetastet	⋊ h ɛ r a n t a s t ə n ⋉	⋊ h ɛ r a n g ə t a s t ə t ⋉
1368	1886	ɪ n t ə r n a l iː z iː r ə n	ɪ n t ə r n a l iː z iː r t	internalisieren	internalisiert	⋊ ɪ n t ə r n a l iː z iː r ə n ⋉	⋊ ɪ n t ə r n a l iː z iː r t ⋉
1388	1909	r a ŋ ʒ iː r ə n	r a ŋ ʒ iː r t	rangieren	rangiert	⋊ r a ŋ ʒ iː r ə n ⋉	⋊ r a ŋ ʒ iː r t ⋉
1400	1923	f ɛ r v ɪ ʃ ə n	f ɛ r v ɪ ʃ t	verwischen	verwischt	⋊ f ɛ r v ɪ ʃ ə n ⋉	⋊ f ɛ r v ɪ ʃ t ⋉
1416	1944	a p aː r t ə n	a p g ə aː r t ə t	abarten	abgeartet	⋊ a p aː r t ə n ⋉	⋊ a p g ə aː r t ə t ⋉
1447	1982	v ai̯ t ə r ʃ p iː l ə n	v ai̯ t ə r g ə ʃ p iː l t	weiterspielen	weitergespielt	⋊ v a i t ə r ʃ p iː l ə n ⋉	⋊ v a i t ə r g ə ʃ p iː l t ⋉
1449	1984	z iː d ə l n	g ə z iː d ə l t	siedeln	gesiedelt	⋊ z iː d ə l n ⋉	⋊ z iː d ə l t ⋉
1502	2064	au̯ f h ɛ ts ə n	au̯ f g ə h ɛ ts t	aufhetzen	aufgehetzt	⋊ a u f h ɛ ts ə n ⋉	⋊ a u f g ə h ɛ ts t ⋉
1511	2077	ɛ r t r ɔ ts ə n	ɛ r t r ɔ ts t	ertrotzen	ertrotzt	⋊ ɛ r t r ɔ ts ə n ⋉	⋊ ɛ r t r ɔ ts t ⋉
1522	2096	ʊ n t ə r ʃ ɛ ts ə n	ʊ n t ə r ʃ ɛ ts t	unterschätzen	unterschätzt	⋊ ʊ n t ə r ʃ ɛ ts ə n ⋉	⋊ ʊ n t ə r ʃ ɛ ts t ⋉
1538	2115	ts uː v a k s ə n	ts uː g ə v a k s ə n	zuwachsen	zugewachsen	⋊ ts uː v a k s ə n ⋉	⋊ ts uː g ə v a k s ə n ⋉
1540	2117	ʊ n t ə r ʃ t eː ə n	ʊ n t ə r ʃ t a n d ə n	unterstehen	unterstanden	⋊ ʊ n t ə r ʃ t eː ə n ⋉	⋊ ʊ n t ə r ʃ t a n d ə n ⋉
1599	2192	ts uː ts iː ə n	ts uː g ə ts oː g ə n	zuziehen	zugezogen	⋊ ts uː ts iː ə n ⋉	⋊ ts uː g ə ts oː g ə n ⋉
1640	2244	au̯ s ʃ aː l ə n	au̯ s g ə ʃ aː l t	ausschalen	ausgeschalt	⋊ a u s ʃ aː l ə n ⋉	⋊ a u s g ə ʃ aː l t ⋉
1642	2246	r eː ts iː p iː r ə n	r eː ts iː p iː r t	rezipieren	rezipiert	⋊ r eː ts iː p iː r ə n ⋉	⋊ r eː ts iː p iː r t ⋉
1662	2272	h ɛ r f oː r g eː ə n	h ɛ r f oː r g ə g a ŋ ə n	hervorgehen	hervorgegangen	⋊ h ɛ r f oː r g eː ə n ⋉	⋊ h ɛ r f oː r g ə g a ŋ ə n ⋉
1671	2283	b ə ʃ t r ɪ k ə n	b ə ʃ t r ɪ k t	bestricken	bestrickt	⋊ b ə ʃ t r ɪ k ə n ⋉	⋊ b ə ʃ t r ɪ k t ⋉
1673	2285	f ɛ r ʃ ai̯ d ə n	f ɛ r ʃ iː d ə n	verscheiden	verschieden	⋊ f ɛ r ʃ a i d ə n ⋉	⋊ f ɛ r ʃ iː d ə n ⋉
1677	2290	g ɛː n ə n	g ə g ɛː n t	gaehnen	gegaehnt	⋊ g ɛː n ə n ⋉	⋊ g ɛː n t ⋉
1687	2302	ɛ r v a x ə n	ɛ r v a x t	erwachen	erwacht	⋊ ɛ r v a x ə n ⋉	⋊ ɛ r v a x t ⋉
1693	2316	ɛ n t ʃ ɛː d ɪ g ə n	ɛ n t ʃ ɛː d ɪ ç t	entschädigen	entschädigt	⋊ ɛ n t ʃ ɛː d ɪ g ə n ⋉	⋊ ɛ n t ʃ ɛː d ɪ ç t ⋉
1699	2325	k n a p s ə n	g ə k n a p s t	knapsen	geknapst	⋊ k n a p s ə n ⋉	⋊ k n a p s t ⋉
1732	2369	f ɛ r ʃ r ai̯ ə n	f ɛ r ʃ r iː n	verschreien	verschrien	⋊ f ɛ r ʃ r a i ə n ⋉	⋊ f ɛ r ʃ r iː n ⋉
1746	2392	au̯ s b a l a n s iː r ə n	au̯ s b a l a n s iː r t	ausbalancieren	ausbalanciert	⋊ a u s b a l a n s iː r ə n ⋉	⋊ a u s b a l a n s iː r t ⋉
1774	2434	ai̯ n h ai̯ ts ə n	ai̯ n g ə h ai̯ ts t	einheizen	eingeheizt	⋊ a i n h a i ts ə n ⋉	⋊ a i n g ə h a i ts t ⋉
1792	2455	d ʊ r ç m ʏ s ə n	d ʊ r ç g ə m ʊ s t	durchmüssen	durchgemusst	⋊ d ʊ r ç m ʏ s ə n ⋉	⋊ d ʊ r ç g ə m ʊ s t ⋉
1802	2468	au̯ f b r au̯ x ə n	au̯ f g ə b r au̯ x t	aufbrauchen	aufgebraucht	⋊ a u f b r a u x ə n ⋉	⋊ a u f g ə b r a u x t ⋉
1813	2480	b ə b r yː t ə n	b ə b r yː t ə t	bebrüten	bebrütet	⋊ b ə b r yː t ə n ⋉	⋊ b ə b r yː t ə t ⋉
1831	2498	yː b ə r r ʊ n d ə n	yː b ə r r ʊ n d ə t	überrunden	überrundet	⋊ yː b ə r r ʊ n d ə n ⋉	⋊ yː b ə r r ʊ n d ə t ⋉
1842	2515	a n r ai̯ z ə n	a n g ə r ai̯ s t	anreisen	angereist	⋊ a n r a i z ə n ⋉	⋊ a n g ə r a i s t ⋉
1849	2528	ʃ t ɛ m p ə l n	g ə ʃ t ɛ m p ə l t	stempeln	gestempelt	⋊ ʃ t ɛ m p ə l n ⋉	⋊ ʃ t ɛ m p ə l t ⋉
1869	2556	f ɛ r ʃ øː n ə n	f ɛ r ʃ øː n t	verschönen	verschönt	⋊ f ɛ r ʃ øː n ə n ⋉	⋊ f ɛ r ʃ øː n t ⋉
1873	2560	f ɔ l g ə n	g ə f ɔ l k t	folgen	gefolgt	⋊ f ɔ l g ə n ⋉	⋊ f ɔ l k t ⋉
1877	2565	a s iː m iː l iː r ə n	a s iː m iː l iː r t	assimilieren	assimiliert	⋊ a s iː m iː l iː r ə n ⋉	⋊ a s iː m iː l iː r t ⋉
1878	2566	d oi̯ t ə n	g ə d oi̯ t ə t	deuten	gedeutet	⋊ d o i t ə n ⋉	⋊ d o i t ə t ⋉
1915	2618	f ai̯ k s ə n	g ə f ai̯ k s t	feixen	gefeixt	⋊ f a i k s ə n ⋉	⋊ f a i k s t ⋉
1927	2631	g ə r aː d ə ʃ t eː ə n	g ə r aː d ə g ə ʃ t a n d ə n	geradestehen	geradegestanden	⋊ g ə r aː d ə ʃ t eː ə n ⋉	⋊ r aː d ə g ə ʃ t a n d ə n ⋉
1935	2643	v ɪ r tʃ a f t ə n	g ə v ɪ r tʃ a f t ə t	wirtschaften	gewirtschaftet	⋊ v ɪ r tʃ a f t ə n ⋉	⋊ v ɪ r tʃ a f t ə t ⋉
1980	2702	n aː x k au̯ f ə n	n aː x g ə k au̯ f t	nachkaufen	nachgekauft	⋊ n aː x k a u f ə n ⋉	⋊ n aː x g ə k a u f t ⋉
1988	2711	au̯ s r a s t ə n	au̯ s g ə r a s t ə t	ausrasten	ausgerastet	⋊ a u s r a s t ə n ⋉	⋊ a u s g ə r a s t ə t ⋉
1994	2719	a p l ɔ x ə n	a p g ə l ɔ x t	ablochen	abgelocht	⋊ a p l ɔ x ə n ⋉	⋊ a p g ə l ɔ x t ⋉
2033	2767	k ɔ n d iː ts iː oː n iː r ə n	k ɔ n d iː ts iː oː n iː r t	konditionieren	konditioniert	⋊ k ɔ n d iː ts iː oː n iː r ə n ⋉	⋊ k ɔ n d iː ts iː oː n iː r t ⋉
2047	2789	f ɔ l t a ŋ k ə n	f ɔ l g ə t a ŋ k t	volltanken	vollgetankt	⋊ f ɔ l t a ŋ k ə n ⋉	⋊ f ɔ l g ə t a ŋ k t ⋉
2073	2821	d eː l oː ʒ iː r ə n	d eː l oː ʒ iː r t	delogieren	delogiert	⋊ d eː l oː ʒ iː r ə n ⋉	⋊ d eː l oː ʒ iː r t ⋉
2084	2836	f ɛ r h øː n ə n	f ɛ r h øː n t	verhöhnen	verhöhnt	⋊ f ɛ r h øː n ə n ⋉	⋊ f ɛ r h øː n t ⋉
2105	2869	uː r b aː r iː z iː r ə n	uː r b aː r iː z iː r t	urbarisieren	urbarisiert	⋊ uː r b aː r iː z iː r ə n ⋉	⋊ uː r b aː r iː z iː r t ⋉
2110	2875	v ai̯ t ə r f ɛ r v ɛ n d ə n	v ai̯ t ə r f ɛ r v a n t	weiterverwenden	weiterverwandt	⋊ v a i t ə r f ɛ r v ɛ n d ə n ⋉	⋊ v a i t ə r f ɛ r v a n t ⋉
2127	2899	a n h ɛ r ʃ ə n	a n g ə h ɛ r ʃ t	anherrschen	angeherrscht	⋊ a n h ɛ r ʃ ə n ⋉	⋊ a n g ə h ɛ r ʃ t ⋉
2158	2946	au̯ f f a s ə n	au̯ f g ə f a s t	auffassen	aufgefasst	⋊ a u f f a s ə n ⋉	⋊ a u f g ə f a s t ⋉
2166	2956	ɪ m a t r iː k uː l iː r ə n	ɪ m a t r iː k uː l iː r t	immatrikulieren	immatrikuliert	⋊ ɪ m a t r iː k uː l iː r ə n ⋉	⋊ ɪ m a t r iː k uː l iː r t ⋉
2173	2964	a n r uː d ə r n	a n g ə r uː d ə r t	anrudern	angerudert	⋊ a n r uː d ə r n ⋉	⋊ a n g ə r uː d ə r t ⋉
2237	3042	a p r ʏ k ə n	a p g ə r ʏ k t	abrücken	abgerückt	⋊ a p r ʏ k ə n ⋉	⋊ a p g ə r ʏ k t ⋉
2278	3089	p r oː p a g iː r ə n	p r oː p a g iː r t	propagieren	propagiert	⋊ p r oː p a g iː r ə n ⋉	⋊ p r oː p a g iː r t ⋉
2281	3095	f ɛ r l ai̯ ə n	f ɛ r l iː n	verleihen	verliehn	⋊ f ɛ r l a i ə n ⋉	⋊ f ɛ r l iː n ⋉
2320	3147	ʃ œ pf ə n	g ə ʃ œ pf t	schöpfen	geschöpft	⋊ ʃ œ pf ə n ⋉	⋊ ʃ œ pf t ⋉
2343	3174	ai̯ n øː l ə n	ai̯ n g ə øː l t	einölen	eingeölt	⋊ a i n øː l ə n ⋉	⋊ a i n g ə øː l t ⋉
2351	3187	b l ɛ t ə r n	g ə b l ɛ t ə r t	blättern	geblättert	⋊ b l ɛ t ə r n ⋉	⋊ b l ɛ t ə r t ⋉
2364	3209	r a l iː iː r ə n	r a l iː iː r t	ralliieren	ralliiert	⋊ r a l iː iː r ə n ⋉	⋊ r a l iː iː r t ⋉
2368	3213	eː l ɔ k s iː r ə n	eː l ɔ k s iː r t	eloxieren	eloxiert	⋊ eː l ɔ k s iː r ə n ⋉	⋊ eː l ɔ k s iː r t ⋉
2377	3223	ʃ t ai̯ n ɪ g ə n	g ə ʃ t ai̯ n ɪ ç t	steinigen	gesteinigt	⋊ ʃ t a i n ɪ g ə n ⋉	⋊ ʃ t a i n ɪ ç t ⋉
2385	3236	m aː z ə r n	g ə m aː z ə r t	masern	gemasert	⋊ m aː z ə r n ⋉	⋊ m aː z ə r t ⋉
2413	3270	n aː x z ɪ ts ə n	n aː x g ə z ɛ s ə n	nachsitzen	nachgesessen	⋊ n aː x z ɪ ts ə n ⋉	⋊ n aː x g ə z ɛ s ə n ⋉
2416	3273	f ɛ r f ɛ l ʃ ə n	f ɛ r f ɛ l ʃ t	verfälschen	verfälscht	⋊ f ɛ r f ɛ l ʃ ə n ⋉	⋊ f ɛ r f ɛ l ʃ t ⋉
2425	3284	ɔ f ə n l a s ə n	ɔ f ə n g ə l a s ə n	offenlassen	offengelassen	⋊ ɔ f ə n l a s ə n ⋉	⋊ ɔ f ə n g ə l a s ə n ⋉
2452	3325	f oː r f ɪ n d ə n	f oː r g ə f ʊ n d ə n	vorfinden	vorgefunden	⋊ f oː r f ɪ n d ə n ⋉	⋊ f oː r g ə f ʊ n d ə n ⋉
2463	3339	ai̯ n b l aː z ə n	ai̯ n g ə b l aː z ə n	einblasen	eingeblasen	⋊ a i n b l aː z ə n ⋉	⋊ a i n g ə b l aː z ə n ⋉
2465	3343	h ɛ r au̯ s h a l t ə n	h ɛ r au̯ s g ə h a l t ə n	heraushalten	herausgehalten	⋊ h ɛ r a u s h a l t ə n ⋉	⋊ h ɛ r a u s g ə h a l t ə n ⋉
2492	3378	a n ʃ t ɛ k ə n	a n g ə ʃ t ɛ k t	anstecken	angesteckt	⋊ a n ʃ t ɛ k ə n ⋉	⋊ a n g ə ʃ t ɛ k t ⋉
2497	3388	f ɛ r ʃ n ʊ pf ə n	f ɛ r ʃ n ʊ pf t	verschnupfen	verschnupft	⋊ f ɛ r ʃ n ʊ pf ə n ⋉	⋊ f ɛ r ʃ n ʊ pf t ⋉
2500	3391	b ə d r ʏ k ə n	b ə d r ʏ k t	bedrücken	bedrückt	⋊ b ə d r ʏ k ə n ⋉	⋊ b ə d r ʏ k t ⋉
2501	3392	au̯ f ʃ p r eː ə n	au̯ f g ə ʃ p r eː t	aufsprayen	aufgesprayt	⋊ a u f ʃ p r eː ə n ⋉	⋊ a u f g ə ʃ p r eː t ⋉
2509	3402	t ʊ ʃ ə n	g ə t ʊ ʃ t	tuschen	getuscht	⋊ t ʊ ʃ ə n ⋉	⋊ t ʊ ʃ t ⋉
2539	3436	ʊ m r ai̯ s ə n	ʊ m g ə r ɪ s ə n	umreissen	umgerissen	⋊ ʊ m r a i s ə n ⋉	⋊ ʊ m g ə r ɪ s ə n ⋉
2543	3440	v iː d ə r b ə l eː b ə n	v iː d ə r b ə l eː p t	wiederbeleben	wiederbelebt	⋊ v iː d ə r b ə l eː b ə n ⋉	⋊ v iː d ə r b ə l eː p t ⋉
2582	3486	b l ʊ b ə r n	g ə b l ʊ b ə r t	blubbern	geblubbert	⋊ b l ʊ b ə r n ⋉	⋊ b l ʊ b ə r t ⋉
2588	3492	ʃ iː r ə n	g ə ʃ iː r t	schieren	geschiert	⋊ ʃ iː r ə n ⋉	⋊ ʃ iː r t ⋉
2631	3544	v iː z ə l n	g ə v iː z ə l t	wieseln	gewieselt	⋊ v iː z ə l n ⋉	⋊ v iː z ə l t ⋉
2632	3545	au̯ s ʃ r ai̯ b ə n	au̯ s g ə ʃ r iː b ə n	ausschreiben	ausgeschrieben	⋊ a u s ʃ r a i b ə n ⋉	⋊ a u s g ə ʃ r iː b ə n ⋉
2633	3547	yː b ə r h eː b ə n	yː b ə r g ə h oː b ə n	überheben	übergehoben	⋊ yː b ə r h eː b ə n ⋉	⋊ yː b ə r g ə h oː b ə n ⋉
2638	3552	f ɛ r ʃ m ɛː ə n	f ɛ r ʃ m ɛː t	verschmaehen	verschmaeht	⋊ f ɛ r ʃ m ɛː ə n ⋉	⋊ f ɛ r ʃ m ɛː t ⋉
2644	3560	ɪ r l ɪ ç t ə r n	g ə ɪ r l ɪ ç t ə r t	irrlichtern	geirrlichtert	⋊ ɪ r l ɪ ç t ə r n ⋉	⋊ ɪ r l ɪ ç t ə r t ⋉
2651	3568	k a s t r iː r ə n	k a s t r iː r t	kastrieren	kastriert	⋊ k a s t r iː r ə n ⋉	⋊ k a s t r iː r t ⋉
2663	3585	h ɪ n b iː g ə n	h ɪ n g ə b oː g ə n	hinbiegen	hingebogen	⋊ h ɪ n b iː g ə n ⋉	⋊ h ɪ n g ə b oː g ə n ⋉
2669	3594	p ʊ b l iː ts iː r ə n	p ʊ b l iː ts iː r t	publizieren	publiziert	⋊ p ʊ b l iː ts iː r ə n ⋉	⋊ p ʊ b l iː ts iː r t ⋉
2670	3595	d ʊ r ç f yː r ə n	d ʊ r ç g ə f yː r t	durchführen	durchgeführt	⋊ d ʊ r ç f yː r ə n ⋉	⋊ d ʊ r ç g ə f yː r t ⋉
2673	3599	k l ɛ t ə r n	g ə k l ɛ t ə r t	klettern	geklettert	⋊ k l ɛ t ə r n ⋉	⋊ k l ɛ t ə r t ⋉
2680	3607	r eː v a k ts iː n iː r ə n	r eː v a k ts iː n iː r t	revakzinieren	revakziniert	⋊ r eː v a k ts iː n iː r ə n ⋉	⋊ r eː v a k ts iː n iː r t ⋉
2693	3627	ai̯ n b ə t oː n iː r ə n	ai̯ n b ə t oː n iː r t	einbetonieren	einbetoniert	⋊ a i n b ə t oː n iː r ə n ⋉	⋊ a i n b ə t oː n iː r t ⋉
2698	3632	m ɔ s t ə n	g ə m ɔ s t ə t	mosten	gemostet	⋊ m ɔ s t ə n ⋉	⋊ m ɔ s t ə t ⋉
2705	3640	g r ɔ l ə n	g ə g r ɔ l t	grollen	gegrollt	⋊ g r ɔ l ə n ⋉	⋊ g r ɔ l t ⋉
2706	3641	au̯ f d r ɛ ŋ ə l n	au̯ f g ə d r ɛ ŋ ə l t	aufdrängeln	aufgedrängelt	⋊ a u f d r ɛ ŋ ə l n ⋉	⋊ a u f g ə d r ɛ ŋ ə l t ⋉
2738	3687	yː b ə r p r yː f ə n	yː b ə r p r yː f t	überprüfen	überprüft	⋊ yː b ə r p r yː f ə n ⋉	⋊ yː b ə r p r yː f t ⋉
2787	3762	yː b ə r f r aː g ə n	yː b ə r f r aː k t	überfragen	überfragt	⋊ yː b ə r f r aː g ə n ⋉	⋊ yː b ə r f r aː k t ⋉
2800	3781	n aː ə ʃ t eː ə n	n aː ə g ə ʃ t a n d ə n	nahestehen	nahegestanden	⋊ n aː ə ʃ t eː ə n ⋉	⋊ n aː ə g ə ʃ t a n d ə n ⋉
2803	3784	ʊ n t ə r t iː t ə l n	ʊ n t ə r t iː t ə l t	untertiteln	untertitelt	⋊ ʊ n t ə r t iː t ə l n ⋉	⋊ ʊ n t ə r t iː t ə l t ⋉
2807	3791	yː b ə r k l eː b ə n	yː b ə r k l eː p t	überkleben	überklebt	⋊ yː b ə r k l eː b ə n ⋉	⋊ yː b ə r k l eː p t ⋉
2820	3808	h ɛ r ai̯ n f a l ə n	h ɛ r ai̯ n g ə f a l ə n	hereinfallen	hereingefallen	⋊ h ɛ r a i n f a l ə n ⋉	⋊ h ɛ r a i n g ə f a l ə n ⋉
2824	3812	a p g ʊ k ə n	a p g ə g ʊ k t	abgucken	abgeguckt	⋊ a p g ʊ k ə n ⋉	⋊ a p g ə g ʊ k t ⋉
2838	3832	t r a k t iː r ə n	t r a k t iː r t	traktieren	traktiert	⋊ t r a k t iː r ə n ⋉	⋊ t r a k t iː r t ⋉
2867	3872	h ɛ r ai̯ n b r ɛ x ə n	h ɛ r ai̯ n g ə b r ɔ x ə n	hereinbrechen	hereingebrochen	⋊ h ɛ r a i n b r ɛ x ə n ⋉	⋊ h ɛ r a i n g ə b r ɔ x ə n ⋉
2882	3894	v ai̯ x ə n	g ə v ai̯ x t	weichen	geweicht	⋊ v a i x ə n ⋉	⋊ v a i x t ⋉
2901	3918	ai̯ n f yː r ə n	ai̯ n g ə f yː r t	einführen	eingeführt	⋊ a i n f yː r ə n ⋉	⋊ a i n g ə f yː r t ⋉
2908	3928	au̯ s ʃ p ɛː ə n	au̯ s g ə ʃ p ɛː t	ausspaehen	ausgespaeht	⋊ a u s ʃ p ɛː ə n ⋉	⋊ a u s g ə ʃ p ɛː t ⋉
2913	3933	p ɪ n ə n	g ə p ɪ n t	pinnen	gepinnt	⋊ p ɪ n ə n ⋉	⋊ p ɪ n t ⋉
2925	3946	h ai̯ l ə n	g ə h ai̯ l t	heilen	geheilt	⋊ h a i l ə n ⋉	⋊ h a i l t ⋉
2926	3947	v ɛ k ʃ ɪ k ə n	v ɛ k g ə ʃ ɪ k t	wegschicken	weggeschickt	⋊ v ɛ k ʃ ɪ k ə n ⋉	⋊ v ɛ k g ə ʃ ɪ k t ⋉
2936	3957	t r ɛ n ts ə n	g ə t r ɛ n ts t	trenzen	getrenzt	⋊ t r ɛ n ts ə n ⋉	⋊ t r ɛ n ts t ⋉
2957	3990	ʃ oi̯ ə n	g ə ʃ oi̯ t	scheuen	gescheut	⋊ ʃ o i ə n ⋉	⋊ ʃ o i t ⋉
2980	4018	yː b ə r t r eː t ə n	yː b ə r g ə t r eː t ə n	übertreten	übergetreten	⋊ yː b ə r t r eː t ə n ⋉	⋊ yː b ə r g ə t r eː t ə n ⋉
2986	4027	ɛ r v ai̯ z ə n	ɛ r v iː z ə n	erweisen	erwiesen	⋊ ɛ r v a i z ə n ⋉	⋊ ɛ r v iː z ə n ⋉
3015	4071	f ɛ r k ɪ t ə n	f ɛ r k ɪ t ə t	verkitten	verkittet	⋊ f ɛ r k ɪ t ə n ⋉	⋊ f ɛ r k ɪ t ə t ⋉
3045	4118	v ɛ k ʃ eː r ə n	v ɛ k g ə ʃ eː r t	wegscheren	weggeschert	⋊ v ɛ k ʃ eː r ə n ⋉	⋊ v ɛ k g ə ʃ eː r t ⋉
3047	4121	r eː t r oː v ɛ r t iː r ə n	r eː t r oː v ɛ r t iː r t	retrovertieren	retrovertiert	⋊ r eː t r oː v ɛ r t iː r ə n ⋉	⋊ r eː t r oː v ɛ r t iː r t ⋉
3099	4199	yː b ə r f l uː t ə n	yː b ə r f l uː t ə t	überfluten	überflutet	⋊ yː b ə r f l uː t ə n ⋉	⋊ yː b ə r f l uː t ə t ⋉
3104	4207	f ɛ r ʃ l ɛ p ə n	f ɛ r ʃ l ɛ p t	verschleppen	verschleppt	⋊ f ɛ r ʃ l ɛ p ə n ⋉	⋊ f ɛ r ʃ l ɛ p t ⋉
3134	4247	ɪ n k ɔ m oː d iː r ə n	ɪ n k ɔ m oː d iː r t	inkommodieren	inkommodiert	⋊ ɪ n k ɔ m oː d iː r ə n ⋉	⋊ ɪ n k ɔ m oː d iː r t ⋉
3167	4288	g r yː s ə n	g ə g r yː s t	grüssen	gegrüsst	⋊ g r yː s ə n ⋉	⋊ g r yː s t ⋉
